{
  "scannedAt": "2026-02-08T14:04:26.311Z",
  "companyName": "Dice Containers",
  "baseUrl": "https://dicecontainers.com.ar/",
  "homepage": {
    "title": "Dice Containers – Casas Containers en Argentina",
    "metaDescription": "",
    "fullText": "Ir al contenido Home Propiedades Casa Container 15m² Casa Container 30m² Casa Container 60m² Casa Container 90m2 Quienes Somos Servicios Fabricación Habilitaciones Contratación Asesoramiento Opiniones Contacto Home Propiedades Casa Container 15m² Casa Container 30m² Casa Container 60m² Casa Container 90m2 Quienes Somos Servicios Fabricación Habilitaciones Contratación Asesoramiento Opiniones Contacto Home Propiedades Casa Container 15m² Casa Container 30m² Casa Container 60m² Casa Container 90m2 Quienes Somos Servicios Fabricación Habilitaciones Contratación Asesoramiento Opiniones Contacto Home Propiedades Casa Container 15m² Casa Container 30m² Casa Container 60m² Casa Container 90m2 Quienes Somos Servicios Fabricación Habilitaciones Contratación Asesoramiento Opiniones Contacto Home Propiedades Casa Container 15m² Casa Container 30m² Casa Container 60m² Casa Container 90m2 Quienes Somos Servicios Fabricación Habilitaciones Contratación Asesoramiento Opiniones Contacto Home Propiedades Casa Container 15m² Casa Container 30m² Casa Container 60m² Casa Container 90m2 Quienes Somos Servicios Fabricación Habilitaciones Contratación Asesoramiento Opiniones Contacto CASAS CONTAINERHASTA 72 CUOTAS FIJASVER MÁSSOLUCIONES MODULADASModulamos viviendas, locales comerciales, quinchos, talleres, a partir de contenedores marítimos.​VER MÁSPROYECTOS A MEDIDARealizamos proyectos adaptados a las necesidades de cada cliente.VER MÁSPLANTA ESPECIALIZADACon Ingeniero & Arquitecto ayudándote durante todo el proceso.VER MÁS CASAS CONTAINERHASTA 72 CUOTAS FIJASVER MÁSSOLUCIONES MODULADASModulamos viviendas, locales comerciales, quinchos, talleres, a partir de contenedores marítimos.​VER MÁSPROYECTOS A MEDIDARealizamos proyectos adaptados a las necesidades de cada cliente.VER MÁSPLANTA ESPECIALIZADACon Ingeniero & Arquitecto ayudándote durante todo el proceso.VER MÁS CASAS CONTAINERHASTA 72 CUOTAS FIJASVER MÁSSOLUCIONES MODULADASModulamos viviendas, locales comerciales, quinchos, talleres, a partir de contenedores marítimos.​VER MÁSPROYECTOS A MEDIDARealizamos proyectos adaptados a las necesidades de cada cliente.VER MÁSPLANTA ESPECIALIZADACon Ingeniero & Arquitecto ayudándote durante todo el proceso.VER MÁS Casa Container 90m2 5 Amb 2 Baño ver más Casa Container 60m² 4 Amb 1 Baño ver más Casa Container 30m² 2 Amb 1 Baño ver más Casa Container 15m² 1 Amb 1 Baño ver más Una empresa joven pero con experiencia Con dos años en el mercado, pero con una larga trayectoria en la ingeniería, arquitectura y la industria metalúrgica, aplicamos técnicas de reutilizaron de containers marítimos, para la modulación de viviendas, locales comerciales y todo tipo de unidades que satisfagan las necesidades en la vida cotidiana de nuestros clientes.En nuestras instalaciones, contamos con profesionales que utilizan técnicas aplicadas en todo el mundo para la fabricación de las unidades en tiempos mínimos Nuestros modelos son de fácil manipulación y adaptación a todo tipo de entorno. FABRICACIÓN Modulamos viviendas, locales comerciales, quinchos, talleres, a partir de contenedores marítimos. INGENIERÍA Productos con terminaciones de primer nivel, logrando resistencia a las condiciones exteriores y calidez de hogar en su interior. DISEÑO Desarrollos de productos estándar y adaptación de pedidos especiales de nuestros clientes. ÚNICOS EN ARGENTINA Unidades 100% habilitables Somos la única empresa constructora de casas container que cumple con todas las normativas municipales Argentinas, por lo tanto las casas Dice son las únicas aptas para habilitación municipal. DESPREOCUPATE ÚNICA CONTRATACIÓN Ingeniero, Arquitecto, Planos, Habilitaciones, Mano de Obra, Materiales, Herramientas, Electricista, Plomería, Seguros de personal. Absolutamente todo lo que necesita tu casa, en una única contratación y bajo nuestra responsabilidad, para que sólo te preocupes de disfrutarla. NOS OCUPAMOS DE TODO Asesoría e instalación Asesoria para su óptima instalación mediante un plantel de profesionales especializados. Proyectos Destacados Casa en la isla – 90 m2 y Galería con Deck en altura Proyectos Destacados Casa en La Toscana – 30 m2 con galería Proyectos Destacados Casa de 60 m2 Carla OzziniNogoyá, Entre Ríos La verdad tenía muchas dudas al principio sobre el sistema y quedé anonadada luego de la visita. Un éxito total! Gracias por todo José! Germán RieraNueva Córdoba Casa en el campo. Muy buena atención de José y todo su equipo. Excelente los detalles y terminaciones. Lo recomiendo. Agustina PalaciosRosario, Santa Fe Estoy enamorada de mi taller-container. Gracias por la propuesta, por el asesoramiento de todo su equipo! Carla OzziniNogoyá, Entre Ríos La verdad tenía muchas dudas al principio sobre el sistema y quedé anonadada luego de la visita. Un éxito total! Gracias por todo José! Germán RieraNueva Córdoba Casa en el campo. Muy buena atención de José y todo su equipo. Excelente los detalles y terminaciones. Lo recomiendo. Consultanos por whatsapp Con sólo un click +54 9 341 675-6601 Tu próximo proyecto, comienza contactándonos! Paulo VI 670 2124 Villa Gobernador Galvez - Santa Fe +54 9 341 675-6601 dicecontainers@gmail.com Lunes A Viernes de 8:00 a 16:00 Hs",
    "screenshotFile": "01-homepage.png"
  },
  "navigation": [
    {
      "text": "Home",
      "href": "https://dicecontainers.com.ar/"
    },
    {
      "text": "Propiedades",
      "href": "https://www.dicecontainers.com.ar/propiedades-dice"
    },
    {
      "text": "Casa Container 15m²",
      "href": "https://dicecontainers.com.ar/propiedades-dice/casa-container-15m%c2%b2/"
    },
    {
      "text": "Casa Container 30m²",
      "href": "https://dicecontainers.com.ar/propiedades-dice/casa-container-30m%c2%b2/"
    },
    {
      "text": "Casa Container 60m²",
      "href": "https://dicecontainers.com.ar/propiedades-dice/casa-container-60m%c2%b2/"
    },
    {
      "text": "Casa Container 90m2",
      "href": "https://dicecontainers.com.ar/propiedades-dice/casa-container-90m2/"
    },
    {
      "text": "Quienes Somos",
      "href": "https://dicecontainers.com.ar/#quienessomos"
    },
    {
      "text": "Servicios",
      "href": "https://dicecontainers.com.ar/#"
    },
    {
      "text": "Fabricación",
      "href": "https://dicecontainers.com.ar/#fabricacion"
    },
    {
      "text": "Habilitaciones",
      "href": "https://dicecontainers.com.ar/#habilitaciones"
    },
    {
      "text": "Contratación",
      "href": "https://dicecontainers.com.ar/#contratacion"
    },
    {
      "text": "Asesoramiento",
      "href": "https://dicecontainers.com.ar/#asesoramiento"
    },
    {
      "text": "Opiniones",
      "href": "https://dicecontainers.com.ar/#opiniones"
    },
    {
      "text": "Contacto",
      "href": "https://dicecontainers.com.ar/#contacto"
    }
  ],
  "sections": [
    {
      "name": "Casa Container 15m²",
      "url": "https://dicecontainers.com.ar/propiedades-dice/casa-container-15m%c2%b2/",
      "text": "Ir al contenido Home Propiedades Casa Container 15m² Casa Container 30m² Casa Container 60m² Casa Container 90m2 Quienes Somos Servicios Fabricación Habilitaciones Contratación Asesoramiento Opiniones Contacto Home Propiedades Casa Container 15m² Casa Container 30m² Casa Container 60m² Casa Container 90m2 Quienes Somos Servicios Fabricación Habilitaciones Contratación Asesoramiento Opiniones Contacto Home Propiedades Casa Container 15m² Casa Container 30m² Casa Container 60m² Casa Container 90m2 Quienes Somos Servicios Fabricación Habilitaciones Contratación Asesoramiento Opiniones Contacto Home Propiedades Casa Container 15m² Casa Container 30m² Casa Container 60m² Casa Container 90m2 Quienes Somos Servicios Fabricación Habilitaciones Contratación Asesoramiento Opiniones Contacto Home Propiedades Casa Container 15m² Casa Container 30m² Casa Container 60m² Casa Container 90m2 Quienes Somos Servicios Fabricación Habilitaciones Contratación Asesoramiento Opiniones Contacto Home Propiedades Casa Container 15m² Casa Container 30m² Casa Container 60m² Casa Container 90m2 Quienes Somos Servicios Fabricación Habilitaciones Contratación Asesoramiento Opiniones Contacto Casa Container 15m² 1 Ambiente/s 1 Baño/s Pies: 20 Largo: 6 mts. Ancho: 2.43 mts. Alto: 2.69 mts. Contado: USD 18369 + I.V.A. 10.5% o adelanto de USD 9184 + I.V.A. 10.5% + 72 cuotas de USD 247 + I.V.A. 10.5% o 72 cuotas de USD 494 + I.V.A. 10.5% Entrega e instalación en todo el país 100% Habilitables Ingeniero & Arquitecto Fabricación en planta especializada Dice Instalación en todo el país. Distribución: – Un (1) Mono ambiente, con ventana (0.8 mts x 2 mts) y persiana corrediza metálica con cierre interno, con bajo mesada de 100cm mesada y alacena de 100cm. Una (1) ventana (2.2 mts x 2.2 mts) y persianas metálicas con cierre interno. Una (1) Puerta (0.8 mts x 2 mts). – Un (1) baño completo, incluye inodoro con deposito exterior, bidetmatic, vanistorio y espejo, receptáculo ducho (120cm x 70cm) + media ampara vidrio, calefón electrico y ventana (50 cm x 100 cm), puerta placa de comunicación interior al pasillo. Terminaciones: – Pintura exterior poliuretano color Negro. – Revestimiento térmico interior de lana de vidrio. Revestimiento de terminación mdf 9mm pintado. – Revestimiento Baño durlock 9mm pintado blanco. – Conexiones de agua fría y caliente con sus respectivos artículos de funcionamiento, conexiones mediante caños de pvc unidos por termo fusión. – Conexión eléctrica interior embutida, distribuida a través de tubos corrugados ignífugos, iluminación led, con 2 plafones en cocina comedor, dos plafones en baño. Cuenta con luces exterior. tomas y puntos correspondientes a cada habitación. Incluye térmica y disyuntor. – Pisos flotantes (7mm) madera. – Aberturas en aluminio blanco línea Módena. – Un (1) Aire acondicionado frio calor de 2000fg. Plano Propiedad: Casa Container 15m² Casa Container 90m2 5 Amb 2 Baño ver más Casa Container 60m² 4 Amb 1 Baño ver más Casa Container 30m² 2 Amb 1 Baño ver más Casa Container 15m² 1 Amb 1 Baño ver más Consultanos por whatsapp Con sólo un click +54 9 341 675-6601 Tu próximo proyecto, comienza contactándonos! Paulo VI 670 2124 Villa Gobernador Galvez - Santa Fe +54 9 341 675-6601 dicecontainers@gmail.com Lunes A Viernes de 8:00 a 16:00 Hs",
      "screenshotFile": "03-section-casa-container-15m-1.png",
      "subLinks": [
        {
          "text": "Ir al contenido",
          "href": "https://dicecontainers.com.ar/propiedades-dice/casa-container-15m%c2%b2/#content"
        },
        {
          "text": "",
          "href": "https://dicecontainers.com.ar/"
        },
        {
          "text": "Home",
          "href": "https://dicecontainers.com.ar/"
        },
        {
          "text": "Casa Container 15m²",
          "href": "https://dicecontainers.com.ar/propiedades-dice/casa-container-15m%c2%b2/"
        },
        {
          "text": "Casa Container 30m²",
          "href": "https://dicecontainers.com.ar/propiedades-dice/casa-container-30m%c2%b2/"
        },
        {
          "text": "Casa Container 60m²",
          "href": "https://dicecontainers.com.ar/propiedades-dice/casa-container-60m%c2%b2/"
        },
        {
          "text": "Casa Container 90m2",
          "href": "https://dicecontainers.com.ar/propiedades-dice/casa-container-90m2/"
        },
        {
          "text": "Quienes Somos",
          "href": "https://dicecontainers.com.ar/#quienessomos"
        },
        {
          "text": "Servicios",
          "href": "https://dicecontainers.com.ar/propiedades-dice/casa-container-15m%c2%b2/#"
        },
        {
          "text": "Fabricación",
          "href": "https://dicecontainers.com.ar/#fabricacion"
        },
        {
          "text": "Habilitaciones",
          "href": "https://dicecontainers.com.ar/#habilitaciones"
        },
        {
          "text": "Contratación",
          "href": "https://dicecontainers.com.ar/#contratacion"
        },
        {
          "text": "Asesoramiento",
          "href": "https://dicecontainers.com.ar/#asesoramiento"
        },
        {
          "text": "Opiniones",
          "href": "https://dicecontainers.com.ar/#opiniones"
        },
        {
          "text": "Contacto",
          "href": "https://dicecontainers.com.ar/#contacto"
        },
        {
          "text": "Home",
          "href": "https://dicecontainers.com.ar/"
        },
        {
          "text": "Casa Container 15m²",
          "href": "https://dicecontainers.com.ar/propiedades-dice/casa-container-15m%c2%b2/"
        },
        {
          "text": "Casa Container 30m²",
          "href": "https://dicecontainers.com.ar/propiedades-dice/casa-container-30m%c2%b2/"
        },
        {
          "text": "Casa Container 60m²",
          "href": "https://dicecontainers.com.ar/propiedades-dice/casa-container-60m%c2%b2/"
        },
        {
          "text": "Casa Container 90m2",
          "href": "https://dicecontainers.com.ar/propiedades-dice/casa-container-90m2/"
        },
        {
          "text": "Quienes Somos",
          "href": "https://dicecontainers.com.ar/#quienessomos"
        },
        {
          "text": "Servicios",
          "href": "https://dicecontainers.com.ar/propiedades-dice/casa-container-15m%c2%b2/#"
        },
        {
          "text": "Fabricación",
          "href": "https://dicecontainers.com.ar/#fabricacion"
        },
        {
          "text": "Habilitaciones",
          "href": "https://dicecontainers.com.ar/#habilitaciones"
        },
        {
          "text": "Contratación",
          "href": "https://dicecontainers.com.ar/#contratacion"
        },
        {
          "text": "Asesoramiento",
          "href": "https://dicecontainers.com.ar/#asesoramiento"
        },
        {
          "text": "Opiniones",
          "href": "https://dicecontainers.com.ar/#opiniones"
        },
        {
          "text": "Contacto",
          "href": "https://dicecontainers.com.ar/#contacto"
        },
        {
          "text": "",
          "href": "https://dicecontainers.com.ar/"
        },
        {
          "text": "Home",
          "href": "https://dicecontainers.com.ar/"
        },
        {
          "text": "Casa Container 15m²",
          "href": "https://dicecontainers.com.ar/propiedades-dice/casa-container-15m%c2%b2/"
        },
        {
          "text": "Casa Container 30m²",
          "href": "https://dicecontainers.com.ar/propiedades-dice/casa-container-30m%c2%b2/"
        },
        {
          "text": "Casa Container 60m²",
          "href": "https://dicecontainers.com.ar/propiedades-dice/casa-container-60m%c2%b2/"
        },
        {
          "text": "Casa Container 90m2",
          "href": "https://dicecontainers.com.ar/propiedades-dice/casa-container-90m2/"
        },
        {
          "text": "Quienes Somos",
          "href": "https://dicecontainers.com.ar/#quienessomos"
        },
        {
          "text": "Servicios",
          "href": "https://dicecontainers.com.ar/propiedades-dice/casa-container-15m%c2%b2/#"
        },
        {
          "text": "Fabricación",
          "href": "https://dicecontainers.com.ar/#fabricacion"
        },
        {
          "text": "Habilitaciones",
          "href": "https://dicecontainers.com.ar/#habilitaciones"
        },
        {
          "text": "Contratación",
          "href": "https://dicecontainers.com.ar/#contratacion"
        },
        {
          "text": "Asesoramiento",
          "href": "https://dicecontainers.com.ar/#asesoramiento"
        },
        {
          "text": "Opiniones",
          "href": "https://dicecontainers.com.ar/#opiniones"
        },
        {
          "text": "Contacto",
          "href": "https://dicecontainers.com.ar/#contacto"
        },
        {
          "text": "Home",
          "href": "https://dicecontainers.com.ar/"
        },
        {
          "text": "Casa Container 15m²",
          "href": "https://dicecontainers.com.ar/propiedades-dice/casa-container-15m%c2%b2/"
        },
        {
          "text": "Casa Container 30m²",
          "href": "https://dicecontainers.com.ar/propiedades-dice/casa-container-30m%c2%b2/"
        },
        {
          "text": "Casa Container 60m²",
          "href": "https://dicecontainers.com.ar/propiedades-dice/casa-container-60m%c2%b2/"
        },
        {
          "text": "Casa Container 90m2",
          "href": "https://dicecontainers.com.ar/propiedades-dice/casa-container-90m2/"
        },
        {
          "text": "Quienes Somos",
          "href": "https://dicecontainers.com.ar/#quienessomos"
        },
        {
          "text": "Servicios",
          "href": "https://dicecontainers.com.ar/propiedades-dice/casa-container-15m%c2%b2/#"
        },
        {
          "text": "Fabricación",
          "href": "https://dicecontainers.com.ar/#fabricacion"
        },
        {
          "text": "Habilitaciones",
          "href": "https://dicecontainers.com.ar/#habilitaciones"
        },
        {
          "text": "Contratación",
          "href": "https://dicecontainers.com.ar/#contratacion"
        },
        {
          "text": "Asesoramiento",
          "href": "https://dicecontainers.com.ar/#asesoramiento"
        },
        {
          "text": "Opiniones",
          "href": "https://dicecontainers.com.ar/#opiniones"
        },
        {
          "text": "Contacto",
          "href": "https://dicecontainers.com.ar/#contacto"
        },
        {
          "text": "",
          "href": "https://dicecontainers.com.ar/"
        },
        {
          "text": "Home",
          "href": "https://dicecontainers.com.ar/"
        },
        {
          "text": "Casa Container 15m²",
          "href": "https://dicecontainers.com.ar/propiedades-dice/casa-container-15m%c2%b2/"
        },
        {
          "text": "Casa Container 30m²",
          "href": "https://dicecontainers.com.ar/propiedades-dice/casa-container-30m%c2%b2/"
        },
        {
          "text": "Casa Container 60m²",
          "href": "https://dicecontainers.com.ar/propiedades-dice/casa-container-60m%c2%b2/"
        },
        {
          "text": "Casa Container 90m2",
          "href": "https://dicecontainers.com.ar/propiedades-dice/casa-container-90m2/"
        },
        {
          "text": "Quienes Somos",
          "href": "https://dicecontainers.com.ar/#quienessomos"
        },
        {
          "text": "Servicios",
          "href": "https://dicecontainers.com.ar/propiedades-dice/casa-container-15m%c2%b2/#"
        },
        {
          "text": "Fabricación",
          "href": "https://dicecontainers.com.ar/#fabricacion"
        },
        {
          "text": "Habilitaciones",
          "href": "https://dicecontainers.com.ar/#habilitaciones"
        },
        {
          "text": "Contratación",
          "href": "https://dicecontainers.com.ar/#contratacion"
        },
        {
          "text": "Asesoramiento",
          "href": "https://dicecontainers.com.ar/#asesoramiento"
        },
        {
          "text": "Opiniones",
          "href": "https://dicecontainers.com.ar/#opiniones"
        },
        {
          "text": "Contacto",
          "href": "https://dicecontainers.com.ar/#contacto"
        },
        {
          "text": "",
          "href": "https://dicecontainers.com.ar/"
        },
        {
          "text": "Home",
          "href": "https://dicecontainers.com.ar/"
        },
        {
          "text": "Casa Container 15m²",
          "href": "https://dicecontainers.com.ar/propiedades-dice/casa-container-15m%c2%b2/"
        },
        {
          "text": "Casa Container 30m²",
          "href": "https://dicecontainers.com.ar/propiedades-dice/casa-container-30m%c2%b2/"
        },
        {
          "text": "Casa Container 60m²",
          "href": "https://dicecontainers.com.ar/propiedades-dice/casa-container-60m%c2%b2/"
        },
        {
          "text": "Casa Container 90m2",
          "href": "https://dicecontainers.com.ar/propiedades-dice/casa-container-90m2/"
        },
        {
          "text": "Quienes Somos",
          "href": "https://dicecontainers.com.ar/#quienessomos"
        },
        {
          "text": "Servicios",
          "href": "https://dicecontainers.com.ar/propiedades-dice/casa-container-15m%c2%b2/#"
        },
        {
          "text": "Fabricación",
          "href": "https://dicecontainers.com.ar/#fabricacion"
        },
        {
          "text": "Habilitaciones",
          "href": "https://dicecontainers.com.ar/#habilitaciones"
        },
        {
          "text": "Contratación",
          "href": "https://dicecontainers.com.ar/#contratacion"
        },
        {
          "text": "Asesoramiento",
          "href": "https://dicecontainers.com.ar/#asesoramiento"
        },
        {
          "text": "Opiniones",
          "href": "https://dicecontainers.com.ar/#opiniones"
        },
        {
          "text": "Contacto",
          "href": "https://dicecontainers.com.ar/#contacto"
        },
        {
          "text": "",
          "href": "https://dicecontainers.com.ar/wp-content/uploads/2022/02/15-01-1.png"
        },
        {
          "text": "",
          "href": "https://dicecontainers.com.ar/wp-content/uploads/2022/02/15-03.jpg"
        },
        {
          "text": "",
          "href": "https://dicecontainers.com.ar/wp-content/uploads/2022/02/15-01-1.png"
        },
        {
          "text": "",
          "href": "https://dicecontainers.com.ar/wp-content/uploads/2022/02/15-03.jpg"
        },
        {
          "text": "",
          "href": "https://dicecontainers.com.ar/wp-content/uploads/2022/02/15-01-1.png"
        },
        {
          "text": "",
          "href": "https://dicecontainers.com.ar/wp-content/uploads/2022/02/15-03.jpg"
        },
        {
          "text": "ver más",
          "href": "https://dicecontainers.com.ar/propiedades-dice/casa-container-90m2/"
        },
        {
          "text": "ver más",
          "href": "https://dicecontainers.com.ar/propiedades-dice/casa-container-60m%c2%b2/"
        },
        {
          "text": "ver más",
          "href": "https://dicecontainers.com.ar/propiedades-dice/casa-container-30m%c2%b2/"
        },
        {
          "text": "ver más",
          "href": "https://dicecontainers.com.ar/propiedades-dice/casa-container-15m%c2%b2/"
        },
        {
          "text": "",
          "href": "https://dicecontainers.com.ar/"
        }
      ]
    },
    {
      "name": "Casa Container 30m²",
      "url": "https://dicecontainers.com.ar/propiedades-dice/casa-container-30m%c2%b2/",
      "text": "Ir al contenido Home Propiedades Casa Container 15m² Casa Container 30m² Casa Container 60m² Casa Container 90m2 Quienes Somos Servicios Fabricación Habilitaciones Contratación Asesoramiento Opiniones Contacto Home Propiedades Casa Container 15m² Casa Container 30m² Casa Container 60m² Casa Container 90m2 Quienes Somos Servicios Fabricación Habilitaciones Contratación Asesoramiento Opiniones Contacto Home Propiedades Casa Container 15m² Casa Container 30m² Casa Container 60m² Casa Container 90m2 Quienes Somos Servicios Fabricación Habilitaciones Contratación Asesoramiento Opiniones Contacto Home Propiedades Casa Container 15m² Casa Container 30m² Casa Container 60m² Casa Container 90m2 Quienes Somos Servicios Fabricación Habilitaciones Contratación Asesoramiento Opiniones Contacto Home Propiedades Casa Container 15m² Casa Container 30m² Casa Container 60m² Casa Container 90m2 Quienes Somos Servicios Fabricación Habilitaciones Contratación Asesoramiento Opiniones Contacto Home Propiedades Casa Container 15m² Casa Container 30m² Casa Container 60m² Casa Container 90m2 Quienes Somos Servicios Fabricación Habilitaciones Contratación Asesoramiento Opiniones Contacto Casa Container 30m² 2 Ambiente/s 1 Baño/s Pies: 40 Largo: 6 mts. Ancho: 4.86 mts. Alto: 2.69 mts. Contado: USD 26740 + I.V.A. 10.5% o adelanto de USD 13370 + I.V.A. 10.5% + 72 cuotas de USD 301 + I.V.A. 10.5% o 72 cuotas de USD 603 + I.V.A. 10.5% Entrega e instalación en todo el país 100% Habilitables Ingeniero & Arquitecto Fabricación en planta especializada Dice Instalación en todo el país. Distribución: – Un (1) dormitorio, con ventana (0.8 mts x 2 mts) y persiana corrediza metálica con cierre interno, puerta corrediza de comunicación a la cocina comedor. – Un (1) baño completo, incluye inodoro con deposito exterior, bidetmatic, vanistorio y espejo, receptáculo ducho (120cm x 70cm) + media ampara vidrio, calefón electrico y ventana (50 cm x 100 cm), puerta placa de comunicación interior al pasillo. – Una (1) Cocina comedor, con bajo mesada de 120cm mesada y alacena de 120cm. Dos (2) ventanas (2.2 mts x 2.2 mts) y persianas metálicas con cierre interno. Una (1) Puerta (0.8 mts x 2 mts). Terminaciones: – Pintura exterior poliuretano color Negro. – Revestimiento térmico interior de lana de vidrio. Revestimiento de terminación mdf 9mm pintado. – Revestimiento Baño durlock 9mm pintado blanco. – Conexiones de agua fría y caliente con sus respectivos artículos de funcionamiento, conexiones mediante caños de pvc unidos por termo fusión. – Conexión eléctrica interior embutida, distribuida a través de tubos corrugados ignífugos, iluminación led, con 2 plafones en cocina comedor, dos plafones en baño y un plafón en dormitorio. Cuenta con luces exterior. tomas y puntos correspondientes a cada habitación. Incluye térmica y disyuntor. – Pisos flotantes (7mm) madera. – Aberturas en aluminio blanco línea Módena. – Un (1) Aire acondicionado frio calor de 2000fg. Plano Propiedad: Casa Container 30m² Casa Container 90m2 5 Amb 2 Baño ver más Casa Container 60m² 4 Amb 1 Baño ver más Casa Container 30m² 2 Amb 1 Baño ver más Casa Container 15m² 1 Amb 1 Baño ver más Consultanos por whatsapp Con sólo un click +54 9 341 675-6601 Tu próximo proyecto, comienza contactándonos! Paulo VI 670 2124 Villa Gobernador Galvez - Santa Fe +54 9 341 675-6601 dicecontainers@gmail.com Lunes A Viernes de 8:00 a 16:00 Hs",
      "screenshotFile": "03-section-casa-container-30m-2.png",
      "subLinks": [
        {
          "text": "Ir al contenido",
          "href": "https://dicecontainers.com.ar/propiedades-dice/casa-container-30m%c2%b2/#content"
        },
        {
          "text": "",
          "href": "https://dicecontainers.com.ar/"
        },
        {
          "text": "Home",
          "href": "https://dicecontainers.com.ar/"
        },
        {
          "text": "Casa Container 15m²",
          "href": "https://dicecontainers.com.ar/propiedades-dice/casa-container-15m%c2%b2/"
        },
        {
          "text": "Casa Container 30m²",
          "href": "https://dicecontainers.com.ar/propiedades-dice/casa-container-30m%c2%b2/"
        },
        {
          "text": "Casa Container 60m²",
          "href": "https://dicecontainers.com.ar/propiedades-dice/casa-container-60m%c2%b2/"
        },
        {
          "text": "Casa Container 90m2",
          "href": "https://dicecontainers.com.ar/propiedades-dice/casa-container-90m2/"
        },
        {
          "text": "Quienes Somos",
          "href": "https://dicecontainers.com.ar/#quienessomos"
        },
        {
          "text": "Servicios",
          "href": "https://dicecontainers.com.ar/propiedades-dice/casa-container-30m%c2%b2/#"
        },
        {
          "text": "Fabricación",
          "href": "https://dicecontainers.com.ar/#fabricacion"
        },
        {
          "text": "Habilitaciones",
          "href": "https://dicecontainers.com.ar/#habilitaciones"
        },
        {
          "text": "Contratación",
          "href": "https://dicecontainers.com.ar/#contratacion"
        },
        {
          "text": "Asesoramiento",
          "href": "https://dicecontainers.com.ar/#asesoramiento"
        },
        {
          "text": "Opiniones",
          "href": "https://dicecontainers.com.ar/#opiniones"
        },
        {
          "text": "Contacto",
          "href": "https://dicecontainers.com.ar/#contacto"
        },
        {
          "text": "Home",
          "href": "https://dicecontainers.com.ar/"
        },
        {
          "text": "Casa Container 15m²",
          "href": "https://dicecontainers.com.ar/propiedades-dice/casa-container-15m%c2%b2/"
        },
        {
          "text": "Casa Container 30m²",
          "href": "https://dicecontainers.com.ar/propiedades-dice/casa-container-30m%c2%b2/"
        },
        {
          "text": "Casa Container 60m²",
          "href": "https://dicecontainers.com.ar/propiedades-dice/casa-container-60m%c2%b2/"
        },
        {
          "text": "Casa Container 90m2",
          "href": "https://dicecontainers.com.ar/propiedades-dice/casa-container-90m2/"
        },
        {
          "text": "Quienes Somos",
          "href": "https://dicecontainers.com.ar/#quienessomos"
        },
        {
          "text": "Servicios",
          "href": "https://dicecontainers.com.ar/propiedades-dice/casa-container-30m%c2%b2/#"
        },
        {
          "text": "Fabricación",
          "href": "https://dicecontainers.com.ar/#fabricacion"
        },
        {
          "text": "Habilitaciones",
          "href": "https://dicecontainers.com.ar/#habilitaciones"
        },
        {
          "text": "Contratación",
          "href": "https://dicecontainers.com.ar/#contratacion"
        },
        {
          "text": "Asesoramiento",
          "href": "https://dicecontainers.com.ar/#asesoramiento"
        },
        {
          "text": "Opiniones",
          "href": "https://dicecontainers.com.ar/#opiniones"
        },
        {
          "text": "Contacto",
          "href": "https://dicecontainers.com.ar/#contacto"
        },
        {
          "text": "",
          "href": "https://dicecontainers.com.ar/"
        },
        {
          "text": "Home",
          "href": "https://dicecontainers.com.ar/"
        },
        {
          "text": "Casa Container 15m²",
          "href": "https://dicecontainers.com.ar/propiedades-dice/casa-container-15m%c2%b2/"
        },
        {
          "text": "Casa Container 30m²",
          "href": "https://dicecontainers.com.ar/propiedades-dice/casa-container-30m%c2%b2/"
        },
        {
          "text": "Casa Container 60m²",
          "href": "https://dicecontainers.com.ar/propiedades-dice/casa-container-60m%c2%b2/"
        },
        {
          "text": "Casa Container 90m2",
          "href": "https://dicecontainers.com.ar/propiedades-dice/casa-container-90m2/"
        },
        {
          "text": "Quienes Somos",
          "href": "https://dicecontainers.com.ar/#quienessomos"
        },
        {
          "text": "Servicios",
          "href": "https://dicecontainers.com.ar/propiedades-dice/casa-container-30m%c2%b2/#"
        },
        {
          "text": "Fabricación",
          "href": "https://dicecontainers.com.ar/#fabricacion"
        },
        {
          "text": "Habilitaciones",
          "href": "https://dicecontainers.com.ar/#habilitaciones"
        },
        {
          "text": "Contratación",
          "href": "https://dicecontainers.com.ar/#contratacion"
        },
        {
          "text": "Asesoramiento",
          "href": "https://dicecontainers.com.ar/#asesoramiento"
        },
        {
          "text": "Opiniones",
          "href": "https://dicecontainers.com.ar/#opiniones"
        },
        {
          "text": "Contacto",
          "href": "https://dicecontainers.com.ar/#contacto"
        },
        {
          "text": "Home",
          "href": "https://dicecontainers.com.ar/"
        },
        {
          "text": "Casa Container 15m²",
          "href": "https://dicecontainers.com.ar/propiedades-dice/casa-container-15m%c2%b2/"
        },
        {
          "text": "Casa Container 30m²",
          "href": "https://dicecontainers.com.ar/propiedades-dice/casa-container-30m%c2%b2/"
        },
        {
          "text": "Casa Container 60m²",
          "href": "https://dicecontainers.com.ar/propiedades-dice/casa-container-60m%c2%b2/"
        },
        {
          "text": "Casa Container 90m2",
          "href": "https://dicecontainers.com.ar/propiedades-dice/casa-container-90m2/"
        },
        {
          "text": "Quienes Somos",
          "href": "https://dicecontainers.com.ar/#quienessomos"
        },
        {
          "text": "Servicios",
          "href": "https://dicecontainers.com.ar/propiedades-dice/casa-container-30m%c2%b2/#"
        },
        {
          "text": "Fabricación",
          "href": "https://dicecontainers.com.ar/#fabricacion"
        },
        {
          "text": "Habilitaciones",
          "href": "https://dicecontainers.com.ar/#habilitaciones"
        },
        {
          "text": "Contratación",
          "href": "https://dicecontainers.com.ar/#contratacion"
        },
        {
          "text": "Asesoramiento",
          "href": "https://dicecontainers.com.ar/#asesoramiento"
        },
        {
          "text": "Opiniones",
          "href": "https://dicecontainers.com.ar/#opiniones"
        },
        {
          "text": "Contacto",
          "href": "https://dicecontainers.com.ar/#contacto"
        },
        {
          "text": "",
          "href": "https://dicecontainers.com.ar/"
        },
        {
          "text": "Home",
          "href": "https://dicecontainers.com.ar/"
        },
        {
          "text": "Casa Container 15m²",
          "href": "https://dicecontainers.com.ar/propiedades-dice/casa-container-15m%c2%b2/"
        },
        {
          "text": "Casa Container 30m²",
          "href": "https://dicecontainers.com.ar/propiedades-dice/casa-container-30m%c2%b2/"
        },
        {
          "text": "Casa Container 60m²",
          "href": "https://dicecontainers.com.ar/propiedades-dice/casa-container-60m%c2%b2/"
        },
        {
          "text": "Casa Container 90m2",
          "href": "https://dicecontainers.com.ar/propiedades-dice/casa-container-90m2/"
        },
        {
          "text": "Quienes Somos",
          "href": "https://dicecontainers.com.ar/#quienessomos"
        },
        {
          "text": "Servicios",
          "href": "https://dicecontainers.com.ar/propiedades-dice/casa-container-30m%c2%b2/#"
        },
        {
          "text": "Fabricación",
          "href": "https://dicecontainers.com.ar/#fabricacion"
        },
        {
          "text": "Habilitaciones",
          "href": "https://dicecontainers.com.ar/#habilitaciones"
        },
        {
          "text": "Contratación",
          "href": "https://dicecontainers.com.ar/#contratacion"
        },
        {
          "text": "Asesoramiento",
          "href": "https://dicecontainers.com.ar/#asesoramiento"
        },
        {
          "text": "Opiniones",
          "href": "https://dicecontainers.com.ar/#opiniones"
        },
        {
          "text": "Contacto",
          "href": "https://dicecontainers.com.ar/#contacto"
        },
        {
          "text": "",
          "href": "https://dicecontainers.com.ar/"
        },
        {
          "text": "Home",
          "href": "https://dicecontainers.com.ar/"
        },
        {
          "text": "Casa Container 15m²",
          "href": "https://dicecontainers.com.ar/propiedades-dice/casa-container-15m%c2%b2/"
        },
        {
          "text": "Casa Container 30m²",
          "href": "https://dicecontainers.com.ar/propiedades-dice/casa-container-30m%c2%b2/"
        },
        {
          "text": "Casa Container 60m²",
          "href": "https://dicecontainers.com.ar/propiedades-dice/casa-container-60m%c2%b2/"
        },
        {
          "text": "Casa Container 90m2",
          "href": "https://dicecontainers.com.ar/propiedades-dice/casa-container-90m2/"
        },
        {
          "text": "Quienes Somos",
          "href": "https://dicecontainers.com.ar/#quienessomos"
        },
        {
          "text": "Servicios",
          "href": "https://dicecontainers.com.ar/propiedades-dice/casa-container-30m%c2%b2/#"
        },
        {
          "text": "Fabricación",
          "href": "https://dicecontainers.com.ar/#fabricacion"
        },
        {
          "text": "Habilitaciones",
          "href": "https://dicecontainers.com.ar/#habilitaciones"
        },
        {
          "text": "Contratación",
          "href": "https://dicecontainers.com.ar/#contratacion"
        },
        {
          "text": "Asesoramiento",
          "href": "https://dicecontainers.com.ar/#asesoramiento"
        },
        {
          "text": "Opiniones",
          "href": "https://dicecontainers.com.ar/#opiniones"
        },
        {
          "text": "Contacto",
          "href": "https://dicecontainers.com.ar/#contacto"
        },
        {
          "text": "",
          "href": "https://dicecontainers.com.ar/wp-content/uploads/2022/02/P30m2_exterior.jpg"
        },
        {
          "text": "",
          "href": "https://dicecontainers.com.ar/wp-content/uploads/2022/02/P30m2_interior.jpg"
        },
        {
          "text": "",
          "href": "https://dicecontainers.com.ar/wp-content/uploads/2022/02/P30m2_exterior.jpg"
        },
        {
          "text": "",
          "href": "https://dicecontainers.com.ar/wp-content/uploads/2022/02/P30m2_interior.jpg"
        },
        {
          "text": "",
          "href": "https://dicecontainers.com.ar/wp-content/uploads/2022/02/P30m2_exterior.jpg"
        },
        {
          "text": "",
          "href": "https://dicecontainers.com.ar/wp-content/uploads/2022/02/P30m2_interior.jpg"
        },
        {
          "text": "ver más",
          "href": "https://dicecontainers.com.ar/propiedades-dice/casa-container-90m2/"
        },
        {
          "text": "ver más",
          "href": "https://dicecontainers.com.ar/propiedades-dice/casa-container-60m%c2%b2/"
        },
        {
          "text": "ver más",
          "href": "https://dicecontainers.com.ar/propiedades-dice/casa-container-30m%c2%b2/"
        },
        {
          "text": "ver más",
          "href": "https://dicecontainers.com.ar/propiedades-dice/casa-container-15m%c2%b2/"
        },
        {
          "text": "",
          "href": "https://dicecontainers.com.ar/"
        }
      ]
    },
    {
      "name": "Casa Container 60m²",
      "url": "https://dicecontainers.com.ar/propiedades-dice/casa-container-60m%c2%b2/",
      "text": "Ir al contenido Home Propiedades Casa Container 15m² Casa Container 30m² Casa Container 60m² Casa Container 90m2 Quienes Somos Servicios Fabricación Habilitaciones Contratación Asesoramiento Opiniones Contacto Home Propiedades Casa Container 15m² Casa Container 30m² Casa Container 60m² Casa Container 90m2 Quienes Somos Servicios Fabricación Habilitaciones Contratación Asesoramiento Opiniones Contacto Home Propiedades Casa Container 15m² Casa Container 30m² Casa Container 60m² Casa Container 90m2 Quienes Somos Servicios Fabricación Habilitaciones Contratación Asesoramiento Opiniones Contacto Home Propiedades Casa Container 15m² Casa Container 30m² Casa Container 60m² Casa Container 90m2 Quienes Somos Servicios Fabricación Habilitaciones Contratación Asesoramiento Opiniones Contacto Home Propiedades Casa Container 15m² Casa Container 30m² Casa Container 60m² Casa Container 90m2 Quienes Somos Servicios Fabricación Habilitaciones Contratación Asesoramiento Opiniones Contacto Home Propiedades Casa Container 15m² Casa Container 30m² Casa Container 60m² Casa Container 90m2 Quienes Somos Servicios Fabricación Habilitaciones Contratación Asesoramiento Opiniones Contacto Casa Container 60m² 4 Ambiente/s 1 Baño/s Pies: 80 Largo: 12 mts. Ancho: 4.86 mts. Alto: 2.89 mts. Contado: USD 44463 + I.V.A. 10.5% o adelanto de USD 22232 + I.V.A. 10.5% + 72 cuotas de USD 596 + I.V.A. 10.5% o 72 cuotas de USD 1196 + I.V.A. 10.5% Entrega e instalación en todo el país 100% Habilitables Ingeniero & Arquitecto Fabricación en planta especializada Dice Instalación en todo el país. Distribución: – Dos (2) dormitorio, con ventana (0.8 mts x 2 mts) y persiana corrediza metálica con cierre interno, puerta placa de comunicación interior al pasillo. Placar (1mts) puertas corredizas. Uno de los dormitorios cuenta con puerta corrediza de comunicación al living para su posible uso como estudio. – Un (1) baño completo, incluye inodoro con deposito exterior, bidet, receptáculo ducho (150cm x 70cm) + media ampara vidrio, calefón eléctrico y ventana (50 cm x 100 cm), puerta placa de comunicación al ante baño. – Un (1) ante baño con vanistorio y puerta de comunicación al baño y otra al pasillo. – Una (1) Cocina, con bajo mesada de 180 cm mesada y alacena de 120cm. Una (1) ventanas corredizas (1.5 mts x 0.5 mts) y persianas corredizas metálica con cierre interno. – Un (1) living comedor con Dos (2) ventanas (2.2 mts x 2.2 mts) con persiana metálica. Una (1) puerta (0.8 mts x 2 mts). Una ventana (1.8 mts x 2 mts) y persianas corredizas metálica con cierre interno. Terminaciones: – Pintura exterior poliuretano color elección. – Revestimiento térmico interior de lana de vidrio. Revestimiento de terminación mdf 9mm pintado. – Revestimiento Baño durlock 9mm pintado blanco. – Conexiones de agua fria y caliente con sus respectivos artículos de funcionamiento, conexiones mediante caños de pvc unidos por termo fusión. – Conexión eléctrica interior embutida, distribuida a través de tubos corrugados ignífugos, iluminación led, con 6 plafones en cocina comedor, dos plafones en baño y un plafón en dormitorio. Cuenta con luces exterior. tomas y puntos correspondientes a cada habitación. Incluye térmica y disyuntor. – Pisos flotantes (7mm) madera. – Aberturas en aluminio blanco línea Módena. – Dos (2) Aire acondicionado frio calor de 2000fg. Plano Propiedad: Casa Container 60m² Casa Container 90m2 5 Amb 2 Baño ver más Casa Container 60m² 4 Amb 1 Baño ver más Casa Container 30m² 2 Amb 1 Baño ver más Casa Container 15m² 1 Amb 1 Baño ver más Consultanos por whatsapp Con sólo un click +54 9 341 675-6601 Tu próximo proyecto, comienza contactándonos! Paulo VI 670 2124 Villa Gobernador Galvez - Santa Fe +54 9 341 675-6601 dicecontainers@gmail.com Lunes A Viernes de 8:00 a 16:00 Hs",
      "screenshotFile": "03-section-casa-container-60m-3.png",
      "subLinks": [
        {
          "text": "Ir al contenido",
          "href": "https://dicecontainers.com.ar/propiedades-dice/casa-container-60m%c2%b2/#content"
        },
        {
          "text": "",
          "href": "https://dicecontainers.com.ar/"
        },
        {
          "text": "Home",
          "href": "https://dicecontainers.com.ar/"
        },
        {
          "text": "Casa Container 15m²",
          "href": "https://dicecontainers.com.ar/propiedades-dice/casa-container-15m%c2%b2/"
        },
        {
          "text": "Casa Container 30m²",
          "href": "https://dicecontainers.com.ar/propiedades-dice/casa-container-30m%c2%b2/"
        },
        {
          "text": "Casa Container 60m²",
          "href": "https://dicecontainers.com.ar/propiedades-dice/casa-container-60m%c2%b2/"
        },
        {
          "text": "Casa Container 90m2",
          "href": "https://dicecontainers.com.ar/propiedades-dice/casa-container-90m2/"
        },
        {
          "text": "Quienes Somos",
          "href": "https://dicecontainers.com.ar/#quienessomos"
        },
        {
          "text": "Servicios",
          "href": "https://dicecontainers.com.ar/propiedades-dice/casa-container-60m%c2%b2/#"
        },
        {
          "text": "Fabricación",
          "href": "https://dicecontainers.com.ar/#fabricacion"
        },
        {
          "text": "Habilitaciones",
          "href": "https://dicecontainers.com.ar/#habilitaciones"
        },
        {
          "text": "Contratación",
          "href": "https://dicecontainers.com.ar/#contratacion"
        },
        {
          "text": "Asesoramiento",
          "href": "https://dicecontainers.com.ar/#asesoramiento"
        },
        {
          "text": "Opiniones",
          "href": "https://dicecontainers.com.ar/#opiniones"
        },
        {
          "text": "Contacto",
          "href": "https://dicecontainers.com.ar/#contacto"
        },
        {
          "text": "Home",
          "href": "https://dicecontainers.com.ar/"
        },
        {
          "text": "Casa Container 15m²",
          "href": "https://dicecontainers.com.ar/propiedades-dice/casa-container-15m%c2%b2/"
        },
        {
          "text": "Casa Container 30m²",
          "href": "https://dicecontainers.com.ar/propiedades-dice/casa-container-30m%c2%b2/"
        },
        {
          "text": "Casa Container 60m²",
          "href": "https://dicecontainers.com.ar/propiedades-dice/casa-container-60m%c2%b2/"
        },
        {
          "text": "Casa Container 90m2",
          "href": "https://dicecontainers.com.ar/propiedades-dice/casa-container-90m2/"
        },
        {
          "text": "Quienes Somos",
          "href": "https://dicecontainers.com.ar/#quienessomos"
        },
        {
          "text": "Servicios",
          "href": "https://dicecontainers.com.ar/propiedades-dice/casa-container-60m%c2%b2/#"
        },
        {
          "text": "Fabricación",
          "href": "https://dicecontainers.com.ar/#fabricacion"
        },
        {
          "text": "Habilitaciones",
          "href": "https://dicecontainers.com.ar/#habilitaciones"
        },
        {
          "text": "Contratación",
          "href": "https://dicecontainers.com.ar/#contratacion"
        },
        {
          "text": "Asesoramiento",
          "href": "https://dicecontainers.com.ar/#asesoramiento"
        },
        {
          "text": "Opiniones",
          "href": "https://dicecontainers.com.ar/#opiniones"
        },
        {
          "text": "Contacto",
          "href": "https://dicecontainers.com.ar/#contacto"
        },
        {
          "text": "",
          "href": "https://dicecontainers.com.ar/"
        },
        {
          "text": "Home",
          "href": "https://dicecontainers.com.ar/"
        },
        {
          "text": "Casa Container 15m²",
          "href": "https://dicecontainers.com.ar/propiedades-dice/casa-container-15m%c2%b2/"
        },
        {
          "text": "Casa Container 30m²",
          "href": "https://dicecontainers.com.ar/propiedades-dice/casa-container-30m%c2%b2/"
        },
        {
          "text": "Casa Container 60m²",
          "href": "https://dicecontainers.com.ar/propiedades-dice/casa-container-60m%c2%b2/"
        },
        {
          "text": "Casa Container 90m2",
          "href": "https://dicecontainers.com.ar/propiedades-dice/casa-container-90m2/"
        },
        {
          "text": "Quienes Somos",
          "href": "https://dicecontainers.com.ar/#quienessomos"
        },
        {
          "text": "Servicios",
          "href": "https://dicecontainers.com.ar/propiedades-dice/casa-container-60m%c2%b2/#"
        },
        {
          "text": "Fabricación",
          "href": "https://dicecontainers.com.ar/#fabricacion"
        },
        {
          "text": "Habilitaciones",
          "href": "https://dicecontainers.com.ar/#habilitaciones"
        },
        {
          "text": "Contratación",
          "href": "https://dicecontainers.com.ar/#contratacion"
        },
        {
          "text": "Asesoramiento",
          "href": "https://dicecontainers.com.ar/#asesoramiento"
        },
        {
          "text": "Opiniones",
          "href": "https://dicecontainers.com.ar/#opiniones"
        },
        {
          "text": "Contacto",
          "href": "https://dicecontainers.com.ar/#contacto"
        },
        {
          "text": "Home",
          "href": "https://dicecontainers.com.ar/"
        },
        {
          "text": "Casa Container 15m²",
          "href": "https://dicecontainers.com.ar/propiedades-dice/casa-container-15m%c2%b2/"
        },
        {
          "text": "Casa Container 30m²",
          "href": "https://dicecontainers.com.ar/propiedades-dice/casa-container-30m%c2%b2/"
        },
        {
          "text": "Casa Container 60m²",
          "href": "https://dicecontainers.com.ar/propiedades-dice/casa-container-60m%c2%b2/"
        },
        {
          "text": "Casa Container 90m2",
          "href": "https://dicecontainers.com.ar/propiedades-dice/casa-container-90m2/"
        },
        {
          "text": "Quienes Somos",
          "href": "https://dicecontainers.com.ar/#quienessomos"
        },
        {
          "text": "Servicios",
          "href": "https://dicecontainers.com.ar/propiedades-dice/casa-container-60m%c2%b2/#"
        },
        {
          "text": "Fabricación",
          "href": "https://dicecontainers.com.ar/#fabricacion"
        },
        {
          "text": "Habilitaciones",
          "href": "https://dicecontainers.com.ar/#habilitaciones"
        },
        {
          "text": "Contratación",
          "href": "https://dicecontainers.com.ar/#contratacion"
        },
        {
          "text": "Asesoramiento",
          "href": "https://dicecontainers.com.ar/#asesoramiento"
        },
        {
          "text": "Opiniones",
          "href": "https://dicecontainers.com.ar/#opiniones"
        },
        {
          "text": "Contacto",
          "href": "https://dicecontainers.com.ar/#contacto"
        },
        {
          "text": "",
          "href": "https://dicecontainers.com.ar/"
        },
        {
          "text": "Home",
          "href": "https://dicecontainers.com.ar/"
        },
        {
          "text": "Casa Container 15m²",
          "href": "https://dicecontainers.com.ar/propiedades-dice/casa-container-15m%c2%b2/"
        },
        {
          "text": "Casa Container 30m²",
          "href": "https://dicecontainers.com.ar/propiedades-dice/casa-container-30m%c2%b2/"
        },
        {
          "text": "Casa Container 60m²",
          "href": "https://dicecontainers.com.ar/propiedades-dice/casa-container-60m%c2%b2/"
        },
        {
          "text": "Casa Container 90m2",
          "href": "https://dicecontainers.com.ar/propiedades-dice/casa-container-90m2/"
        },
        {
          "text": "Quienes Somos",
          "href": "https://dicecontainers.com.ar/#quienessomos"
        },
        {
          "text": "Servicios",
          "href": "https://dicecontainers.com.ar/propiedades-dice/casa-container-60m%c2%b2/#"
        },
        {
          "text": "Fabricación",
          "href": "https://dicecontainers.com.ar/#fabricacion"
        },
        {
          "text": "Habilitaciones",
          "href": "https://dicecontainers.com.ar/#habilitaciones"
        },
        {
          "text": "Contratación",
          "href": "https://dicecontainers.com.ar/#contratacion"
        },
        {
          "text": "Asesoramiento",
          "href": "https://dicecontainers.com.ar/#asesoramiento"
        },
        {
          "text": "Opiniones",
          "href": "https://dicecontainers.com.ar/#opiniones"
        },
        {
          "text": "Contacto",
          "href": "https://dicecontainers.com.ar/#contacto"
        },
        {
          "text": "",
          "href": "https://dicecontainers.com.ar/"
        },
        {
          "text": "Home",
          "href": "https://dicecontainers.com.ar/"
        },
        {
          "text": "Casa Container 15m²",
          "href": "https://dicecontainers.com.ar/propiedades-dice/casa-container-15m%c2%b2/"
        },
        {
          "text": "Casa Container 30m²",
          "href": "https://dicecontainers.com.ar/propiedades-dice/casa-container-30m%c2%b2/"
        },
        {
          "text": "Casa Container 60m²",
          "href": "https://dicecontainers.com.ar/propiedades-dice/casa-container-60m%c2%b2/"
        },
        {
          "text": "Casa Container 90m2",
          "href": "https://dicecontainers.com.ar/propiedades-dice/casa-container-90m2/"
        },
        {
          "text": "Quienes Somos",
          "href": "https://dicecontainers.com.ar/#quienessomos"
        },
        {
          "text": "Servicios",
          "href": "https://dicecontainers.com.ar/propiedades-dice/casa-container-60m%c2%b2/#"
        },
        {
          "text": "Fabricación",
          "href": "https://dicecontainers.com.ar/#fabricacion"
        },
        {
          "text": "Habilitaciones",
          "href": "https://dicecontainers.com.ar/#habilitaciones"
        },
        {
          "text": "Contratación",
          "href": "https://dicecontainers.com.ar/#contratacion"
        },
        {
          "text": "Asesoramiento",
          "href": "https://dicecontainers.com.ar/#asesoramiento"
        },
        {
          "text": "Opiniones",
          "href": "https://dicecontainers.com.ar/#opiniones"
        },
        {
          "text": "Contacto",
          "href": "https://dicecontainers.com.ar/#contacto"
        },
        {
          "text": "",
          "href": "https://dicecontainers.com.ar/wp-content/uploads/2022/02/P60m2_exterior_b.jpg"
        },
        {
          "text": "",
          "href": "https://dicecontainers.com.ar/wp-content/uploads/2022/02/P60m2_interior.jpg"
        },
        {
          "text": "",
          "href": "https://dicecontainers.com.ar/wp-content/uploads/2022/02/P60m2_exterior_a.jpg"
        },
        {
          "text": "",
          "href": "https://dicecontainers.com.ar/wp-content/uploads/2022/02/P60m2_exterior_b.jpg"
        },
        {
          "text": "",
          "href": "https://dicecontainers.com.ar/wp-content/uploads/2022/02/P60m2_interior.jpg"
        },
        {
          "text": "",
          "href": "https://dicecontainers.com.ar/wp-content/uploads/2022/02/P60m2_exterior_a.jpg"
        },
        {
          "text": "",
          "href": "https://dicecontainers.com.ar/wp-content/uploads/2022/02/P60m2_exterior_b.jpg"
        },
        {
          "text": "",
          "href": "https://dicecontainers.com.ar/wp-content/uploads/2022/02/P60m2_interior.jpg"
        },
        {
          "text": "",
          "href": "https://dicecontainers.com.ar/wp-content/uploads/2022/02/P60m2_exterior_a.jpg"
        },
        {
          "text": "ver más",
          "href": "https://dicecontainers.com.ar/propiedades-dice/casa-container-90m2/"
        },
        {
          "text": "ver más",
          "href": "https://dicecontainers.com.ar/propiedades-dice/casa-container-60m%c2%b2/"
        },
        {
          "text": "ver más",
          "href": "https://dicecontainers.com.ar/propiedades-dice/casa-container-30m%c2%b2/"
        },
        {
          "text": "ver más",
          "href": "https://dicecontainers.com.ar/propiedades-dice/casa-container-15m%c2%b2/"
        },
        {
          "text": "",
          "href": "https://dicecontainers.com.ar/"
        }
      ]
    },
    {
      "name": "Casa Container 90m2",
      "url": "https://dicecontainers.com.ar/propiedades-dice/casa-container-90m2/",
      "text": "Ir al contenido Home Propiedades Casa Container 15m² Casa Container 30m² Casa Container 60m² Casa Container 90m2 Quienes Somos Servicios Fabricación Habilitaciones Contratación Asesoramiento Opiniones Contacto Home Propiedades Casa Container 15m² Casa Container 30m² Casa Container 60m² Casa Container 90m2 Quienes Somos Servicios Fabricación Habilitaciones Contratación Asesoramiento Opiniones Contacto Home Propiedades Casa Container 15m² Casa Container 30m² Casa Container 60m² Casa Container 90m2 Quienes Somos Servicios Fabricación Habilitaciones Contratación Asesoramiento Opiniones Contacto Home Propiedades Casa Container 15m² Casa Container 30m² Casa Container 60m² Casa Container 90m2 Quienes Somos Servicios Fabricación Habilitaciones Contratación Asesoramiento Opiniones Contacto Home Propiedades Casa Container 15m² Casa Container 30m² Casa Container 60m² Casa Container 90m2 Quienes Somos Servicios Fabricación Habilitaciones Contratación Asesoramiento Opiniones Contacto Home Propiedades Casa Container 15m² Casa Container 30m² Casa Container 60m² Casa Container 90m2 Quienes Somos Servicios Fabricación Habilitaciones Contratación Asesoramiento Opiniones Contacto Casa Container 90m2 5 Ambiente/s 2 Baño/s Pies: 120 Largo: 12 mts. Ancho: 7.29 mts. Alto: 2.89 mts. Contado: USD 65381 + I.V.A. 10.5% o adelanto de USD 32690 + I.V.A. 10.5% + 72 cuotas de USD 879 + I.V.A. 10.5% o 72 cuotas de USD 1758 + I.V.A. 10.5% Entrega e instalación en todo el país 100% Habilitables Ingeniero & Arquitecto Fabricación en planta especializada Dice Instalación en todo el país. Distribución: – Tres (3) dormitorio, con ventana (0.8 mts x 2 mts) y persiana corrediza metálica con cierre interno, puerta placa de comunicación interior al pasillo. Placar (1mts) puertas corredizas. Uno de los dormitorios cuenta con puerta corrediza de comunicación al living para su posible uso como estudio. Uno de los dormitorios cuenta con vestidor. – Un (1) baño completo, incluye inodoro con deposito exterior, bidetmatic, receptáculo ducho (150cm x 70cm) + media ampara vidrio, calefón eléctrico y ventana (50 cm x 100 cm), puerta placa de comunicación al cambiador. – Un (1) baño completo, incluye inodoro con deposito exterior, bidet, receptáculo ducho (150cm x 70cm) + media ampara vidrio, calefón eléctrico puerta placa de comunicación al ante baño. – Un (1) ante baño con vanistorio y puerta de comunicación al baño y otra al pasillo. – Una (1) Cocina, con bajo mesada de 180 cm mesada y alacena de 120cm. Una (1) ventanas corredizas (1.5 mts x 0.5 mts) y persianas corredizas metálica con cierre interno. – Un (1) living comedor con Dos (2) ventanas (2.2 mts x 2.2 mts) con persiana metálica. Una (1) puerta (0.8 mts x 2 mts). Una ventana (1.8 mts x 2 mts) y persianas corredizas metálica con cierre interno. Terminaciones: – Pintura exterior poliuretano color elección. – Revestimiento térmico interior de lana de vidrio. Revestimiento de terminación mdf 9mm pintado. – Revestimiento Baño durlock 9mm pintado blanco. – Conexiones de agua fria y caliente con sus respectivos artículos de funcionamiento, conexiones mediante caños de pvc unidos por termo fusión. – Conexión eléctrica interior embutida, distribuida a través de tubos corrugados ignífugos, iluminación led, con 6 plafones en cocina comedor, dos plafones en baño y un plafón en dormitorio. Cuenta con luces exterior. tomas y puntos correspondientes a cada habitación. Incluye térmica y disyuntor. – Pisos flotantes (7mm) madera. – Aberturas en aluminio blanco línea Módena. – Tres (3) Aire acondicionado frio calor de 2000fg. Plano Propiedad: Casa Container 90m2 Casa Container 90m2 5 Amb 2 Baño ver más Casa Container 60m² 4 Amb 1 Baño ver más Casa Container 30m² 2 Amb 1 Baño ver más Casa Container 15m² 1 Amb 1 Baño ver más Consultanos por whatsapp Con sólo un click +54 9 341 675-6601 Tu próximo proyecto, comienza contactándonos! Paulo VI 670 2124 Villa Gobernador Galvez - Santa Fe +54 9 341 675-6601 dicecontainers@gmail.com Lunes A Viernes de 8:00 a 16:00 Hs",
      "screenshotFile": "03-section-casa-container-90m2-4.png",
      "subLinks": [
        {
          "text": "Ir al contenido",
          "href": "https://dicecontainers.com.ar/propiedades-dice/casa-container-90m2/#content"
        },
        {
          "text": "",
          "href": "https://dicecontainers.com.ar/"
        },
        {
          "text": "Home",
          "href": "https://dicecontainers.com.ar/"
        },
        {
          "text": "Casa Container 15m²",
          "href": "https://dicecontainers.com.ar/propiedades-dice/casa-container-15m%c2%b2/"
        },
        {
          "text": "Casa Container 30m²",
          "href": "https://dicecontainers.com.ar/propiedades-dice/casa-container-30m%c2%b2/"
        },
        {
          "text": "Casa Container 60m²",
          "href": "https://dicecontainers.com.ar/propiedades-dice/casa-container-60m%c2%b2/"
        },
        {
          "text": "Casa Container 90m2",
          "href": "https://dicecontainers.com.ar/propiedades-dice/casa-container-90m2/"
        },
        {
          "text": "Quienes Somos",
          "href": "https://dicecontainers.com.ar/#quienessomos"
        },
        {
          "text": "Servicios",
          "href": "https://dicecontainers.com.ar/propiedades-dice/casa-container-90m2/#"
        },
        {
          "text": "Fabricación",
          "href": "https://dicecontainers.com.ar/#fabricacion"
        },
        {
          "text": "Habilitaciones",
          "href": "https://dicecontainers.com.ar/#habilitaciones"
        },
        {
          "text": "Contratación",
          "href": "https://dicecontainers.com.ar/#contratacion"
        },
        {
          "text": "Asesoramiento",
          "href": "https://dicecontainers.com.ar/#asesoramiento"
        },
        {
          "text": "Opiniones",
          "href": "https://dicecontainers.com.ar/#opiniones"
        },
        {
          "text": "Contacto",
          "href": "https://dicecontainers.com.ar/#contacto"
        },
        {
          "text": "Home",
          "href": "https://dicecontainers.com.ar/"
        },
        {
          "text": "Casa Container 15m²",
          "href": "https://dicecontainers.com.ar/propiedades-dice/casa-container-15m%c2%b2/"
        },
        {
          "text": "Casa Container 30m²",
          "href": "https://dicecontainers.com.ar/propiedades-dice/casa-container-30m%c2%b2/"
        },
        {
          "text": "Casa Container 60m²",
          "href": "https://dicecontainers.com.ar/propiedades-dice/casa-container-60m%c2%b2/"
        },
        {
          "text": "Casa Container 90m2",
          "href": "https://dicecontainers.com.ar/propiedades-dice/casa-container-90m2/"
        },
        {
          "text": "Quienes Somos",
          "href": "https://dicecontainers.com.ar/#quienessomos"
        },
        {
          "text": "Servicios",
          "href": "https://dicecontainers.com.ar/propiedades-dice/casa-container-90m2/#"
        },
        {
          "text": "Fabricación",
          "href": "https://dicecontainers.com.ar/#fabricacion"
        },
        {
          "text": "Habilitaciones",
          "href": "https://dicecontainers.com.ar/#habilitaciones"
        },
        {
          "text": "Contratación",
          "href": "https://dicecontainers.com.ar/#contratacion"
        },
        {
          "text": "Asesoramiento",
          "href": "https://dicecontainers.com.ar/#asesoramiento"
        },
        {
          "text": "Opiniones",
          "href": "https://dicecontainers.com.ar/#opiniones"
        },
        {
          "text": "Contacto",
          "href": "https://dicecontainers.com.ar/#contacto"
        },
        {
          "text": "",
          "href": "https://dicecontainers.com.ar/"
        },
        {
          "text": "Home",
          "href": "https://dicecontainers.com.ar/"
        },
        {
          "text": "Casa Container 15m²",
          "href": "https://dicecontainers.com.ar/propiedades-dice/casa-container-15m%c2%b2/"
        },
        {
          "text": "Casa Container 30m²",
          "href": "https://dicecontainers.com.ar/propiedades-dice/casa-container-30m%c2%b2/"
        },
        {
          "text": "Casa Container 60m²",
          "href": "https://dicecontainers.com.ar/propiedades-dice/casa-container-60m%c2%b2/"
        },
        {
          "text": "Casa Container 90m2",
          "href": "https://dicecontainers.com.ar/propiedades-dice/casa-container-90m2/"
        },
        {
          "text": "Quienes Somos",
          "href": "https://dicecontainers.com.ar/#quienessomos"
        },
        {
          "text": "Servicios",
          "href": "https://dicecontainers.com.ar/propiedades-dice/casa-container-90m2/#"
        },
        {
          "text": "Fabricación",
          "href": "https://dicecontainers.com.ar/#fabricacion"
        },
        {
          "text": "Habilitaciones",
          "href": "https://dicecontainers.com.ar/#habilitaciones"
        },
        {
          "text": "Contratación",
          "href": "https://dicecontainers.com.ar/#contratacion"
        },
        {
          "text": "Asesoramiento",
          "href": "https://dicecontainers.com.ar/#asesoramiento"
        },
        {
          "text": "Opiniones",
          "href": "https://dicecontainers.com.ar/#opiniones"
        },
        {
          "text": "Contacto",
          "href": "https://dicecontainers.com.ar/#contacto"
        },
        {
          "text": "Home",
          "href": "https://dicecontainers.com.ar/"
        },
        {
          "text": "Casa Container 15m²",
          "href": "https://dicecontainers.com.ar/propiedades-dice/casa-container-15m%c2%b2/"
        },
        {
          "text": "Casa Container 30m²",
          "href": "https://dicecontainers.com.ar/propiedades-dice/casa-container-30m%c2%b2/"
        },
        {
          "text": "Casa Container 60m²",
          "href": "https://dicecontainers.com.ar/propiedades-dice/casa-container-60m%c2%b2/"
        },
        {
          "text": "Casa Container 90m2",
          "href": "https://dicecontainers.com.ar/propiedades-dice/casa-container-90m2/"
        },
        {
          "text": "Quienes Somos",
          "href": "https://dicecontainers.com.ar/#quienessomos"
        },
        {
          "text": "Servicios",
          "href": "https://dicecontainers.com.ar/propiedades-dice/casa-container-90m2/#"
        },
        {
          "text": "Fabricación",
          "href": "https://dicecontainers.com.ar/#fabricacion"
        },
        {
          "text": "Habilitaciones",
          "href": "https://dicecontainers.com.ar/#habilitaciones"
        },
        {
          "text": "Contratación",
          "href": "https://dicecontainers.com.ar/#contratacion"
        },
        {
          "text": "Asesoramiento",
          "href": "https://dicecontainers.com.ar/#asesoramiento"
        },
        {
          "text": "Opiniones",
          "href": "https://dicecontainers.com.ar/#opiniones"
        },
        {
          "text": "Contacto",
          "href": "https://dicecontainers.com.ar/#contacto"
        },
        {
          "text": "",
          "href": "https://dicecontainers.com.ar/"
        },
        {
          "text": "Home",
          "href": "https://dicecontainers.com.ar/"
        },
        {
          "text": "Casa Container 15m²",
          "href": "https://dicecontainers.com.ar/propiedades-dice/casa-container-15m%c2%b2/"
        },
        {
          "text": "Casa Container 30m²",
          "href": "https://dicecontainers.com.ar/propiedades-dice/casa-container-30m%c2%b2/"
        },
        {
          "text": "Casa Container 60m²",
          "href": "https://dicecontainers.com.ar/propiedades-dice/casa-container-60m%c2%b2/"
        },
        {
          "text": "Casa Container 90m2",
          "href": "https://dicecontainers.com.ar/propiedades-dice/casa-container-90m2/"
        },
        {
          "text": "Quienes Somos",
          "href": "https://dicecontainers.com.ar/#quienessomos"
        },
        {
          "text": "Servicios",
          "href": "https://dicecontainers.com.ar/propiedades-dice/casa-container-90m2/#"
        },
        {
          "text": "Fabricación",
          "href": "https://dicecontainers.com.ar/#fabricacion"
        },
        {
          "text": "Habilitaciones",
          "href": "https://dicecontainers.com.ar/#habilitaciones"
        },
        {
          "text": "Contratación",
          "href": "https://dicecontainers.com.ar/#contratacion"
        },
        {
          "text": "Asesoramiento",
          "href": "https://dicecontainers.com.ar/#asesoramiento"
        },
        {
          "text": "Opiniones",
          "href": "https://dicecontainers.com.ar/#opiniones"
        },
        {
          "text": "Contacto",
          "href": "https://dicecontainers.com.ar/#contacto"
        },
        {
          "text": "",
          "href": "https://dicecontainers.com.ar/"
        },
        {
          "text": "Home",
          "href": "https://dicecontainers.com.ar/"
        },
        {
          "text": "Casa Container 15m²",
          "href": "https://dicecontainers.com.ar/propiedades-dice/casa-container-15m%c2%b2/"
        },
        {
          "text": "Casa Container 30m²",
          "href": "https://dicecontainers.com.ar/propiedades-dice/casa-container-30m%c2%b2/"
        },
        {
          "text": "Casa Container 60m²",
          "href": "https://dicecontainers.com.ar/propiedades-dice/casa-container-60m%c2%b2/"
        },
        {
          "text": "Casa Container 90m2",
          "href": "https://dicecontainers.com.ar/propiedades-dice/casa-container-90m2/"
        },
        {
          "text": "Quienes Somos",
          "href": "https://dicecontainers.com.ar/#quienessomos"
        },
        {
          "text": "Servicios",
          "href": "https://dicecontainers.com.ar/propiedades-dice/casa-container-90m2/#"
        },
        {
          "text": "Fabricación",
          "href": "https://dicecontainers.com.ar/#fabricacion"
        },
        {
          "text": "Habilitaciones",
          "href": "https://dicecontainers.com.ar/#habilitaciones"
        },
        {
          "text": "Contratación",
          "href": "https://dicecontainers.com.ar/#contratacion"
        },
        {
          "text": "Asesoramiento",
          "href": "https://dicecontainers.com.ar/#asesoramiento"
        },
        {
          "text": "Opiniones",
          "href": "https://dicecontainers.com.ar/#opiniones"
        },
        {
          "text": "Contacto",
          "href": "https://dicecontainers.com.ar/#contacto"
        },
        {
          "text": "",
          "href": "https://dicecontainers.com.ar/wp-content/uploads/2022/02/img04.jpg"
        },
        {
          "text": "",
          "href": "https://dicecontainers.com.ar/wp-content/uploads/2022/02/img03.jpg"
        },
        {
          "text": "",
          "href": "https://dicecontainers.com.ar/wp-content/uploads/2022/02/img02.jpg"
        },
        {
          "text": "",
          "href": "https://dicecontainers.com.ar/wp-content/uploads/2022/02/img01.jpg"
        },
        {
          "text": "",
          "href": "https://dicecontainers.com.ar/wp-content/uploads/2022/02/P90m2_exterior.jpg"
        },
        {
          "text": "",
          "href": "https://dicecontainers.com.ar/wp-content/uploads/2022/02/img016.jpg"
        },
        {
          "text": "",
          "href": "https://dicecontainers.com.ar/wp-content/uploads/2022/02/img015.jpg"
        },
        {
          "text": "",
          "href": "https://dicecontainers.com.ar/wp-content/uploads/2022/02/img014.jpg"
        },
        {
          "text": "",
          "href": "https://dicecontainers.com.ar/wp-content/uploads/2022/02/img013.jpg"
        },
        {
          "text": "",
          "href": "https://dicecontainers.com.ar/wp-content/uploads/2022/02/img012.jpg"
        },
        {
          "text": "",
          "href": "https://dicecontainers.com.ar/wp-content/uploads/2022/02/img011.jpg"
        },
        {
          "text": "",
          "href": "https://dicecontainers.com.ar/wp-content/uploads/2022/02/img010.jpg"
        },
        {
          "text": "",
          "href": "https://dicecontainers.com.ar/wp-content/uploads/2022/02/img09.jpg"
        },
        {
          "text": "",
          "href": "https://dicecontainers.com.ar/wp-content/uploads/2022/02/img08.jpg"
        },
        {
          "text": "",
          "href": "https://dicecontainers.com.ar/wp-content/uploads/2022/02/img07.jpg"
        },
        {
          "text": "",
          "href": "https://dicecontainers.com.ar/wp-content/uploads/2022/02/img06.jpg"
        },
        {
          "text": "",
          "href": "https://dicecontainers.com.ar/wp-content/uploads/2022/02/img05.jpg"
        },
        {
          "text": "",
          "href": "https://dicecontainers.com.ar/wp-content/uploads/2022/02/img04.jpg"
        },
        {
          "text": "",
          "href": "https://dicecontainers.com.ar/wp-content/uploads/2022/02/img03.jpg"
        },
        {
          "text": "",
          "href": "https://dicecontainers.com.ar/wp-content/uploads/2022/02/img02.jpg"
        },
        {
          "text": "",
          "href": "https://dicecontainers.com.ar/wp-content/uploads/2022/02/img01.jpg"
        },
        {
          "text": "",
          "href": "https://dicecontainers.com.ar/wp-content/uploads/2022/02/P90m2_exterior.jpg"
        },
        {
          "text": "",
          "href": "https://dicecontainers.com.ar/wp-content/uploads/2022/02/img016.jpg"
        },
        {
          "text": "",
          "href": "https://dicecontainers.com.ar/wp-content/uploads/2022/02/img015.jpg"
        },
        {
          "text": "",
          "href": "https://dicecontainers.com.ar/wp-content/uploads/2022/02/img014.jpg"
        },
        {
          "text": "ver más",
          "href": "https://dicecontainers.com.ar/propiedades-dice/casa-container-90m2/"
        },
        {
          "text": "ver más",
          "href": "https://dicecontainers.com.ar/propiedades-dice/casa-container-60m%c2%b2/"
        },
        {
          "text": "ver más",
          "href": "https://dicecontainers.com.ar/propiedades-dice/casa-container-30m%c2%b2/"
        },
        {
          "text": "ver más",
          "href": "https://dicecontainers.com.ar/propiedades-dice/casa-container-15m%c2%b2/"
        },
        {
          "text": "",
          "href": "https://dicecontainers.com.ar/"
        }
      ]
    },
    {
      "name": "CASAS CONTAINERHASTA 72 CUOTAS FIJASVER MÁS",
      "url": "https://dicecontainers.com.ar/propiedades-dice/",
      "text": "Ir al contenido Home Propiedades Casa Container 15m² Casa Container 30m² Casa Container 60m² Casa Container 90m2 Quienes Somos Servicios Fabricación Habilitaciones Contratación Asesoramiento Opiniones Contacto Home Propiedades Casa Container 15m² Casa Container 30m² Casa Container 60m² Casa Container 90m2 Quienes Somos Servicios Fabricación Habilitaciones Contratación Asesoramiento Opiniones Contacto Home Propiedades Casa Container 15m² Casa Container 30m² Casa Container 60m² Casa Container 90m2 Quienes Somos Servicios Fabricación Habilitaciones Contratación Asesoramiento Opiniones Contacto Home Propiedades Casa Container 15m² Casa Container 30m² Casa Container 60m² Casa Container 90m2 Quienes Somos Servicios Fabricación Habilitaciones Contratación Asesoramiento Opiniones Contacto Home Propiedades Casa Container 15m² Casa Container 30m² Casa Container 60m² Casa Container 90m2 Quienes Somos Servicios Fabricación Habilitaciones Contratación Asesoramiento Opiniones Contacto Home Propiedades Casa Container 15m² Casa Container 30m² Casa Container 60m² Casa Container 90m2 Quienes Somos Servicios Fabricación Habilitaciones Contratación Asesoramiento Opiniones Contacto Propiedades Dice Casa Container 90m2 5 Amb 2 Baño ver más Casa Container 60m² 4 Amb 1 Baño ver más Casa Container 30m² 2 Amb 1 Baño ver más Casa Container 15m² 1 Amb 1 Baño ver más Consultanos por whatsapp Con sólo un click +54 9 341 675-6601 Tu próximo proyecto, comienza contactándonos! Paulo VI 670 2124 Villa Gobernador Galvez - Santa Fe +54 9 341 675-6601 dicecontainers@gmail.com Lunes A Viernes de 8:00 a 16:00 Hs",
      "screenshotFile": "03-section-casas-containerhasta-72-cuotas-fijasver-m-s-5.png",
      "subLinks": [
        {
          "text": "Ir al contenido",
          "href": "https://dicecontainers.com.ar/propiedades-dice/#content"
        },
        {
          "text": "",
          "href": "https://dicecontainers.com.ar/"
        },
        {
          "text": "Home",
          "href": "https://dicecontainers.com.ar/"
        },
        {
          "text": "Casa Container 15m²",
          "href": "https://dicecontainers.com.ar/propiedades-dice/casa-container-15m%c2%b2/"
        },
        {
          "text": "Casa Container 30m²",
          "href": "https://dicecontainers.com.ar/propiedades-dice/casa-container-30m%c2%b2/"
        },
        {
          "text": "Casa Container 60m²",
          "href": "https://dicecontainers.com.ar/propiedades-dice/casa-container-60m%c2%b2/"
        },
        {
          "text": "Casa Container 90m2",
          "href": "https://dicecontainers.com.ar/propiedades-dice/casa-container-90m2/"
        },
        {
          "text": "Quienes Somos",
          "href": "https://dicecontainers.com.ar/#quienessomos"
        },
        {
          "text": "Servicios",
          "href": "https://dicecontainers.com.ar/propiedades-dice/#"
        },
        {
          "text": "Fabricación",
          "href": "https://dicecontainers.com.ar/#fabricacion"
        },
        {
          "text": "Habilitaciones",
          "href": "https://dicecontainers.com.ar/#habilitaciones"
        },
        {
          "text": "Contratación",
          "href": "https://dicecontainers.com.ar/#contratacion"
        },
        {
          "text": "Asesoramiento",
          "href": "https://dicecontainers.com.ar/#asesoramiento"
        },
        {
          "text": "Opiniones",
          "href": "https://dicecontainers.com.ar/#opiniones"
        },
        {
          "text": "Contacto",
          "href": "https://dicecontainers.com.ar/#contacto"
        },
        {
          "text": "Home",
          "href": "https://dicecontainers.com.ar/"
        },
        {
          "text": "Casa Container 15m²",
          "href": "https://dicecontainers.com.ar/propiedades-dice/casa-container-15m%c2%b2/"
        },
        {
          "text": "Casa Container 30m²",
          "href": "https://dicecontainers.com.ar/propiedades-dice/casa-container-30m%c2%b2/"
        },
        {
          "text": "Casa Container 60m²",
          "href": "https://dicecontainers.com.ar/propiedades-dice/casa-container-60m%c2%b2/"
        },
        {
          "text": "Casa Container 90m2",
          "href": "https://dicecontainers.com.ar/propiedades-dice/casa-container-90m2/"
        },
        {
          "text": "Quienes Somos",
          "href": "https://dicecontainers.com.ar/#quienessomos"
        },
        {
          "text": "Servicios",
          "href": "https://dicecontainers.com.ar/propiedades-dice/#"
        },
        {
          "text": "Fabricación",
          "href": "https://dicecontainers.com.ar/#fabricacion"
        },
        {
          "text": "Habilitaciones",
          "href": "https://dicecontainers.com.ar/#habilitaciones"
        },
        {
          "text": "Contratación",
          "href": "https://dicecontainers.com.ar/#contratacion"
        },
        {
          "text": "Asesoramiento",
          "href": "https://dicecontainers.com.ar/#asesoramiento"
        },
        {
          "text": "Opiniones",
          "href": "https://dicecontainers.com.ar/#opiniones"
        },
        {
          "text": "Contacto",
          "href": "https://dicecontainers.com.ar/#contacto"
        },
        {
          "text": "",
          "href": "https://dicecontainers.com.ar/"
        },
        {
          "text": "Home",
          "href": "https://dicecontainers.com.ar/"
        },
        {
          "text": "Casa Container 15m²",
          "href": "https://dicecontainers.com.ar/propiedades-dice/casa-container-15m%c2%b2/"
        },
        {
          "text": "Casa Container 30m²",
          "href": "https://dicecontainers.com.ar/propiedades-dice/casa-container-30m%c2%b2/"
        },
        {
          "text": "Casa Container 60m²",
          "href": "https://dicecontainers.com.ar/propiedades-dice/casa-container-60m%c2%b2/"
        },
        {
          "text": "Casa Container 90m2",
          "href": "https://dicecontainers.com.ar/propiedades-dice/casa-container-90m2/"
        },
        {
          "text": "Quienes Somos",
          "href": "https://dicecontainers.com.ar/#quienessomos"
        },
        {
          "text": "Servicios",
          "href": "https://dicecontainers.com.ar/propiedades-dice/#"
        },
        {
          "text": "Fabricación",
          "href": "https://dicecontainers.com.ar/#fabricacion"
        },
        {
          "text": "Habilitaciones",
          "href": "https://dicecontainers.com.ar/#habilitaciones"
        },
        {
          "text": "Contratación",
          "href": "https://dicecontainers.com.ar/#contratacion"
        },
        {
          "text": "Asesoramiento",
          "href": "https://dicecontainers.com.ar/#asesoramiento"
        },
        {
          "text": "Opiniones",
          "href": "https://dicecontainers.com.ar/#opiniones"
        },
        {
          "text": "Contacto",
          "href": "https://dicecontainers.com.ar/#contacto"
        },
        {
          "text": "Home",
          "href": "https://dicecontainers.com.ar/"
        },
        {
          "text": "Casa Container 15m²",
          "href": "https://dicecontainers.com.ar/propiedades-dice/casa-container-15m%c2%b2/"
        },
        {
          "text": "Casa Container 30m²",
          "href": "https://dicecontainers.com.ar/propiedades-dice/casa-container-30m%c2%b2/"
        },
        {
          "text": "Casa Container 60m²",
          "href": "https://dicecontainers.com.ar/propiedades-dice/casa-container-60m%c2%b2/"
        },
        {
          "text": "Casa Container 90m2",
          "href": "https://dicecontainers.com.ar/propiedades-dice/casa-container-90m2/"
        },
        {
          "text": "Quienes Somos",
          "href": "https://dicecontainers.com.ar/#quienessomos"
        },
        {
          "text": "Servicios",
          "href": "https://dicecontainers.com.ar/propiedades-dice/#"
        },
        {
          "text": "Fabricación",
          "href": "https://dicecontainers.com.ar/#fabricacion"
        },
        {
          "text": "Habilitaciones",
          "href": "https://dicecontainers.com.ar/#habilitaciones"
        },
        {
          "text": "Contratación",
          "href": "https://dicecontainers.com.ar/#contratacion"
        },
        {
          "text": "Asesoramiento",
          "href": "https://dicecontainers.com.ar/#asesoramiento"
        },
        {
          "text": "Opiniones",
          "href": "https://dicecontainers.com.ar/#opiniones"
        },
        {
          "text": "Contacto",
          "href": "https://dicecontainers.com.ar/#contacto"
        },
        {
          "text": "",
          "href": "https://dicecontainers.com.ar/"
        },
        {
          "text": "Home",
          "href": "https://dicecontainers.com.ar/"
        },
        {
          "text": "Casa Container 15m²",
          "href": "https://dicecontainers.com.ar/propiedades-dice/casa-container-15m%c2%b2/"
        },
        {
          "text": "Casa Container 30m²",
          "href": "https://dicecontainers.com.ar/propiedades-dice/casa-container-30m%c2%b2/"
        },
        {
          "text": "Casa Container 60m²",
          "href": "https://dicecontainers.com.ar/propiedades-dice/casa-container-60m%c2%b2/"
        },
        {
          "text": "Casa Container 90m2",
          "href": "https://dicecontainers.com.ar/propiedades-dice/casa-container-90m2/"
        },
        {
          "text": "Quienes Somos",
          "href": "https://dicecontainers.com.ar/#quienessomos"
        },
        {
          "text": "Servicios",
          "href": "https://dicecontainers.com.ar/propiedades-dice/#"
        },
        {
          "text": "Fabricación",
          "href": "https://dicecontainers.com.ar/#fabricacion"
        },
        {
          "text": "Habilitaciones",
          "href": "https://dicecontainers.com.ar/#habilitaciones"
        },
        {
          "text": "Contratación",
          "href": "https://dicecontainers.com.ar/#contratacion"
        },
        {
          "text": "Asesoramiento",
          "href": "https://dicecontainers.com.ar/#asesoramiento"
        },
        {
          "text": "Opiniones",
          "href": "https://dicecontainers.com.ar/#opiniones"
        },
        {
          "text": "Contacto",
          "href": "https://dicecontainers.com.ar/#contacto"
        },
        {
          "text": "",
          "href": "https://dicecontainers.com.ar/"
        },
        {
          "text": "Home",
          "href": "https://dicecontainers.com.ar/"
        },
        {
          "text": "Casa Container 15m²",
          "href": "https://dicecontainers.com.ar/propiedades-dice/casa-container-15m%c2%b2/"
        },
        {
          "text": "Casa Container 30m²",
          "href": "https://dicecontainers.com.ar/propiedades-dice/casa-container-30m%c2%b2/"
        },
        {
          "text": "Casa Container 60m²",
          "href": "https://dicecontainers.com.ar/propiedades-dice/casa-container-60m%c2%b2/"
        },
        {
          "text": "Casa Container 90m2",
          "href": "https://dicecontainers.com.ar/propiedades-dice/casa-container-90m2/"
        },
        {
          "text": "Quienes Somos",
          "href": "https://dicecontainers.com.ar/#quienessomos"
        },
        {
          "text": "Servicios",
          "href": "https://dicecontainers.com.ar/propiedades-dice/#"
        },
        {
          "text": "Fabricación",
          "href": "https://dicecontainers.com.ar/#fabricacion"
        },
        {
          "text": "Habilitaciones",
          "href": "https://dicecontainers.com.ar/#habilitaciones"
        },
        {
          "text": "Contratación",
          "href": "https://dicecontainers.com.ar/#contratacion"
        },
        {
          "text": "Asesoramiento",
          "href": "https://dicecontainers.com.ar/#asesoramiento"
        },
        {
          "text": "Opiniones",
          "href": "https://dicecontainers.com.ar/#opiniones"
        },
        {
          "text": "Contacto",
          "href": "https://dicecontainers.com.ar/#contacto"
        },
        {
          "text": "ver más",
          "href": "https://dicecontainers.com.ar/propiedades-dice/casa-container-90m2/"
        },
        {
          "text": "ver más",
          "href": "https://dicecontainers.com.ar/propiedades-dice/casa-container-60m%c2%b2/"
        },
        {
          "text": "ver más",
          "href": "https://dicecontainers.com.ar/propiedades-dice/casa-container-30m%c2%b2/"
        },
        {
          "text": "ver más",
          "href": "https://dicecontainers.com.ar/propiedades-dice/casa-container-15m%c2%b2/"
        },
        {
          "text": "",
          "href": "https://dicecontainers.com.ar/"
        }
      ]
    },
    {
      "name": "Propiedades",
      "url": "https://www.dicecontainers.com.ar/propiedades-dice",
      "text": "Ir al contenido Home Propiedades Casa Container 15m² Casa Container 30m² Casa Container 60m² Casa Container 90m2 Quienes Somos Servicios Fabricación Habilitaciones Contratación Asesoramiento Opiniones Contacto Home Propiedades Casa Container 15m² Casa Container 30m² Casa Container 60m² Casa Container 90m2 Quienes Somos Servicios Fabricación Habilitaciones Contratación Asesoramiento Opiniones Contacto Home Propiedades Casa Container 15m² Casa Container 30m² Casa Container 60m² Casa Container 90m2 Quienes Somos Servicios Fabricación Habilitaciones Contratación Asesoramiento Opiniones Contacto Home Propiedades Casa Container 15m² Casa Container 30m² Casa Container 60m² Casa Container 90m2 Quienes Somos Servicios Fabricación Habilitaciones Contratación Asesoramiento Opiniones Contacto Home Propiedades Casa Container 15m² Casa Container 30m² Casa Container 60m² Casa Container 90m2 Quienes Somos Servicios Fabricación Habilitaciones Contratación Asesoramiento Opiniones Contacto Home Propiedades Casa Container 15m² Casa Container 30m² Casa Container 60m² Casa Container 90m2 Quienes Somos Servicios Fabricación Habilitaciones Contratación Asesoramiento Opiniones Contacto Propiedades Dice Casa Container 90m2 5 Amb 2 Baño ver más Casa Container 60m² 4 Amb 1 Baño ver más Casa Container 30m² 2 Amb 1 Baño ver más Casa Container 15m² 1 Amb 1 Baño ver más Consultanos por whatsapp Con sólo un click +54 9 341 675-6601 Tu próximo proyecto, comienza contactándonos! Paulo VI 670 2124 Villa Gobernador Galvez - Santa Fe +54 9 341 675-6601 dicecontainers@gmail.com Lunes A Viernes de 8:00 a 16:00 Hs",
      "screenshotFile": "03-section-propiedades-6.png",
      "subLinks": [
        {
          "text": "Ir al contenido",
          "href": "https://dicecontainers.com.ar/propiedades-dice/#content"
        },
        {
          "text": "",
          "href": "https://dicecontainers.com.ar/"
        },
        {
          "text": "Home",
          "href": "https://dicecontainers.com.ar/"
        },
        {
          "text": "Casa Container 15m²",
          "href": "https://dicecontainers.com.ar/propiedades-dice/casa-container-15m%c2%b2/"
        },
        {
          "text": "Casa Container 30m²",
          "href": "https://dicecontainers.com.ar/propiedades-dice/casa-container-30m%c2%b2/"
        },
        {
          "text": "Casa Container 60m²",
          "href": "https://dicecontainers.com.ar/propiedades-dice/casa-container-60m%c2%b2/"
        },
        {
          "text": "Casa Container 90m2",
          "href": "https://dicecontainers.com.ar/propiedades-dice/casa-container-90m2/"
        },
        {
          "text": "Quienes Somos",
          "href": "https://dicecontainers.com.ar/#quienessomos"
        },
        {
          "text": "Servicios",
          "href": "https://dicecontainers.com.ar/propiedades-dice/#"
        },
        {
          "text": "Fabricación",
          "href": "https://dicecontainers.com.ar/#fabricacion"
        },
        {
          "text": "Habilitaciones",
          "href": "https://dicecontainers.com.ar/#habilitaciones"
        },
        {
          "text": "Contratación",
          "href": "https://dicecontainers.com.ar/#contratacion"
        },
        {
          "text": "Asesoramiento",
          "href": "https://dicecontainers.com.ar/#asesoramiento"
        },
        {
          "text": "Opiniones",
          "href": "https://dicecontainers.com.ar/#opiniones"
        },
        {
          "text": "Contacto",
          "href": "https://dicecontainers.com.ar/#contacto"
        },
        {
          "text": "Home",
          "href": "https://dicecontainers.com.ar/"
        },
        {
          "text": "Casa Container 15m²",
          "href": "https://dicecontainers.com.ar/propiedades-dice/casa-container-15m%c2%b2/"
        },
        {
          "text": "Casa Container 30m²",
          "href": "https://dicecontainers.com.ar/propiedades-dice/casa-container-30m%c2%b2/"
        },
        {
          "text": "Casa Container 60m²",
          "href": "https://dicecontainers.com.ar/propiedades-dice/casa-container-60m%c2%b2/"
        },
        {
          "text": "Casa Container 90m2",
          "href": "https://dicecontainers.com.ar/propiedades-dice/casa-container-90m2/"
        },
        {
          "text": "Quienes Somos",
          "href": "https://dicecontainers.com.ar/#quienessomos"
        },
        {
          "text": "Servicios",
          "href": "https://dicecontainers.com.ar/propiedades-dice/#"
        },
        {
          "text": "Fabricación",
          "href": "https://dicecontainers.com.ar/#fabricacion"
        },
        {
          "text": "Habilitaciones",
          "href": "https://dicecontainers.com.ar/#habilitaciones"
        },
        {
          "text": "Contratación",
          "href": "https://dicecontainers.com.ar/#contratacion"
        },
        {
          "text": "Asesoramiento",
          "href": "https://dicecontainers.com.ar/#asesoramiento"
        },
        {
          "text": "Opiniones",
          "href": "https://dicecontainers.com.ar/#opiniones"
        },
        {
          "text": "Contacto",
          "href": "https://dicecontainers.com.ar/#contacto"
        },
        {
          "text": "",
          "href": "https://dicecontainers.com.ar/"
        },
        {
          "text": "Home",
          "href": "https://dicecontainers.com.ar/"
        },
        {
          "text": "Casa Container 15m²",
          "href": "https://dicecontainers.com.ar/propiedades-dice/casa-container-15m%c2%b2/"
        },
        {
          "text": "Casa Container 30m²",
          "href": "https://dicecontainers.com.ar/propiedades-dice/casa-container-30m%c2%b2/"
        },
        {
          "text": "Casa Container 60m²",
          "href": "https://dicecontainers.com.ar/propiedades-dice/casa-container-60m%c2%b2/"
        },
        {
          "text": "Casa Container 90m2",
          "href": "https://dicecontainers.com.ar/propiedades-dice/casa-container-90m2/"
        },
        {
          "text": "Quienes Somos",
          "href": "https://dicecontainers.com.ar/#quienessomos"
        },
        {
          "text": "Servicios",
          "href": "https://dicecontainers.com.ar/propiedades-dice/#"
        },
        {
          "text": "Fabricación",
          "href": "https://dicecontainers.com.ar/#fabricacion"
        },
        {
          "text": "Habilitaciones",
          "href": "https://dicecontainers.com.ar/#habilitaciones"
        },
        {
          "text": "Contratación",
          "href": "https://dicecontainers.com.ar/#contratacion"
        },
        {
          "text": "Asesoramiento",
          "href": "https://dicecontainers.com.ar/#asesoramiento"
        },
        {
          "text": "Opiniones",
          "href": "https://dicecontainers.com.ar/#opiniones"
        },
        {
          "text": "Contacto",
          "href": "https://dicecontainers.com.ar/#contacto"
        },
        {
          "text": "Home",
          "href": "https://dicecontainers.com.ar/"
        },
        {
          "text": "Casa Container 15m²",
          "href": "https://dicecontainers.com.ar/propiedades-dice/casa-container-15m%c2%b2/"
        },
        {
          "text": "Casa Container 30m²",
          "href": "https://dicecontainers.com.ar/propiedades-dice/casa-container-30m%c2%b2/"
        },
        {
          "text": "Casa Container 60m²",
          "href": "https://dicecontainers.com.ar/propiedades-dice/casa-container-60m%c2%b2/"
        },
        {
          "text": "Casa Container 90m2",
          "href": "https://dicecontainers.com.ar/propiedades-dice/casa-container-90m2/"
        },
        {
          "text": "Quienes Somos",
          "href": "https://dicecontainers.com.ar/#quienessomos"
        },
        {
          "text": "Servicios",
          "href": "https://dicecontainers.com.ar/propiedades-dice/#"
        },
        {
          "text": "Fabricación",
          "href": "https://dicecontainers.com.ar/#fabricacion"
        },
        {
          "text": "Habilitaciones",
          "href": "https://dicecontainers.com.ar/#habilitaciones"
        },
        {
          "text": "Contratación",
          "href": "https://dicecontainers.com.ar/#contratacion"
        },
        {
          "text": "Asesoramiento",
          "href": "https://dicecontainers.com.ar/#asesoramiento"
        },
        {
          "text": "Opiniones",
          "href": "https://dicecontainers.com.ar/#opiniones"
        },
        {
          "text": "Contacto",
          "href": "https://dicecontainers.com.ar/#contacto"
        },
        {
          "text": "",
          "href": "https://dicecontainers.com.ar/"
        },
        {
          "text": "Home",
          "href": "https://dicecontainers.com.ar/"
        },
        {
          "text": "Casa Container 15m²",
          "href": "https://dicecontainers.com.ar/propiedades-dice/casa-container-15m%c2%b2/"
        },
        {
          "text": "Casa Container 30m²",
          "href": "https://dicecontainers.com.ar/propiedades-dice/casa-container-30m%c2%b2/"
        },
        {
          "text": "Casa Container 60m²",
          "href": "https://dicecontainers.com.ar/propiedades-dice/casa-container-60m%c2%b2/"
        },
        {
          "text": "Casa Container 90m2",
          "href": "https://dicecontainers.com.ar/propiedades-dice/casa-container-90m2/"
        },
        {
          "text": "Quienes Somos",
          "href": "https://dicecontainers.com.ar/#quienessomos"
        },
        {
          "text": "Servicios",
          "href": "https://dicecontainers.com.ar/propiedades-dice/#"
        },
        {
          "text": "Fabricación",
          "href": "https://dicecontainers.com.ar/#fabricacion"
        },
        {
          "text": "Habilitaciones",
          "href": "https://dicecontainers.com.ar/#habilitaciones"
        },
        {
          "text": "Contratación",
          "href": "https://dicecontainers.com.ar/#contratacion"
        },
        {
          "text": "Asesoramiento",
          "href": "https://dicecontainers.com.ar/#asesoramiento"
        },
        {
          "text": "Opiniones",
          "href": "https://dicecontainers.com.ar/#opiniones"
        },
        {
          "text": "Contacto",
          "href": "https://dicecontainers.com.ar/#contacto"
        },
        {
          "text": "",
          "href": "https://dicecontainers.com.ar/"
        },
        {
          "text": "Home",
          "href": "https://dicecontainers.com.ar/"
        },
        {
          "text": "Casa Container 15m²",
          "href": "https://dicecontainers.com.ar/propiedades-dice/casa-container-15m%c2%b2/"
        },
        {
          "text": "Casa Container 30m²",
          "href": "https://dicecontainers.com.ar/propiedades-dice/casa-container-30m%c2%b2/"
        },
        {
          "text": "Casa Container 60m²",
          "href": "https://dicecontainers.com.ar/propiedades-dice/casa-container-60m%c2%b2/"
        },
        {
          "text": "Casa Container 90m2",
          "href": "https://dicecontainers.com.ar/propiedades-dice/casa-container-90m2/"
        },
        {
          "text": "Quienes Somos",
          "href": "https://dicecontainers.com.ar/#quienessomos"
        },
        {
          "text": "Servicios",
          "href": "https://dicecontainers.com.ar/propiedades-dice/#"
        },
        {
          "text": "Fabricación",
          "href": "https://dicecontainers.com.ar/#fabricacion"
        },
        {
          "text": "Habilitaciones",
          "href": "https://dicecontainers.com.ar/#habilitaciones"
        },
        {
          "text": "Contratación",
          "href": "https://dicecontainers.com.ar/#contratacion"
        },
        {
          "text": "Asesoramiento",
          "href": "https://dicecontainers.com.ar/#asesoramiento"
        },
        {
          "text": "Opiniones",
          "href": "https://dicecontainers.com.ar/#opiniones"
        },
        {
          "text": "Contacto",
          "href": "https://dicecontainers.com.ar/#contacto"
        },
        {
          "text": "ver más",
          "href": "https://dicecontainers.com.ar/propiedades-dice/casa-container-90m2/"
        },
        {
          "text": "ver más",
          "href": "https://dicecontainers.com.ar/propiedades-dice/casa-container-60m%c2%b2/"
        },
        {
          "text": "ver más",
          "href": "https://dicecontainers.com.ar/propiedades-dice/casa-container-30m%c2%b2/"
        },
        {
          "text": "ver más",
          "href": "https://dicecontainers.com.ar/propiedades-dice/casa-container-15m%c2%b2/"
        },
        {
          "text": "",
          "href": "https://dicecontainers.com.ar/"
        }
      ]
    },
    {
      "name": "section-7",
      "url": "https://dicecontainers.com.ar/wp-content/uploads/2022/02/15-01-1.png",
      "text": "",
      "screenshotFile": "03-section-section-7-7.png",
      "subLinks": []
    },
    {
      "name": "section-8",
      "url": "https://dicecontainers.com.ar/wp-content/uploads/2022/02/15-03.jpg",
      "text": "",
      "screenshotFile": "03-section-section-8-8.png",
      "subLinks": []
    },
    {
      "name": "section-9",
      "url": "https://dicecontainers.com.ar/wp-content/uploads/2022/02/P30m2_exterior.jpg",
      "text": "",
      "screenshotFile": "03-section-section-9-9.png",
      "subLinks": []
    },
    {
      "name": "section-10",
      "url": "https://dicecontainers.com.ar/wp-content/uploads/2022/02/P30m2_interior.jpg",
      "text": "",
      "screenshotFile": "03-section-section-10-10.png",
      "subLinks": []
    },
    {
      "name": "section-11",
      "url": "https://dicecontainers.com.ar/wp-content/uploads/2022/02/P60m2_exterior_b.jpg",
      "text": "",
      "screenshotFile": "03-section-section-11-11.png",
      "subLinks": []
    },
    {
      "name": "section-12",
      "url": "https://dicecontainers.com.ar/wp-content/uploads/2022/02/P60m2_interior.jpg",
      "text": "",
      "screenshotFile": "03-section-section-12-12.png",
      "subLinks": []
    },
    {
      "name": "section-13",
      "url": "https://dicecontainers.com.ar/wp-content/uploads/2022/02/P60m2_exterior_a.jpg",
      "text": "",
      "screenshotFile": "03-section-section-13-13.png",
      "subLinks": []
    },
    {
      "name": "section-14",
      "url": "https://dicecontainers.com.ar/wp-content/uploads/2022/02/img04.jpg",
      "text": "",
      "screenshotFile": "03-section-section-14-14.png",
      "subLinks": []
    },
    {
      "name": "section-15",
      "url": "https://dicecontainers.com.ar/wp-content/uploads/2022/02/img03.jpg",
      "text": "",
      "screenshotFile": "03-section-section-15-15.png",
      "subLinks": []
    },
    {
      "name": "section-16",
      "url": "https://dicecontainers.com.ar/wp-content/uploads/2022/02/img02.jpg",
      "text": "",
      "screenshotFile": "03-section-section-16-16.png",
      "subLinks": []
    },
    {
      "name": "section-17",
      "url": "https://dicecontainers.com.ar/wp-content/uploads/2022/02/img01.jpg",
      "text": "",
      "screenshotFile": "03-section-section-17-17.png",
      "subLinks": []
    },
    {
      "name": "section-18",
      "url": "https://dicecontainers.com.ar/wp-content/uploads/2022/02/P90m2_exterior.jpg",
      "text": "",
      "screenshotFile": "03-section-section-18-18.png",
      "subLinks": []
    },
    {
      "name": "section-19",
      "url": "https://dicecontainers.com.ar/wp-content/uploads/2022/02/img016.jpg",
      "text": "",
      "screenshotFile": "03-section-section-19-19.png",
      "subLinks": []
    },
    {
      "name": "section-20",
      "url": "https://dicecontainers.com.ar/wp-content/uploads/2022/02/img015.jpg",
      "text": "",
      "screenshotFile": "03-section-section-20-20.png",
      "subLinks": []
    },
    {
      "name": "section-21",
      "url": "https://dicecontainers.com.ar/wp-content/uploads/2022/02/img014.jpg",
      "text": "",
      "screenshotFile": "03-section-section-21-21.png",
      "subLinks": []
    },
    {
      "name": "section-22",
      "url": "https://dicecontainers.com.ar/wp-content/uploads/2022/02/img013.jpg",
      "text": "",
      "screenshotFile": "03-section-section-22-22.png",
      "subLinks": []
    },
    {
      "name": "section-23",
      "url": "https://dicecontainers.com.ar/wp-content/uploads/2022/02/img012.jpg",
      "text": "",
      "screenshotFile": "03-section-section-23-23.png",
      "subLinks": []
    },
    {
      "name": "section-24",
      "url": "https://dicecontainers.com.ar/wp-content/uploads/2022/02/img011.jpg",
      "text": "",
      "screenshotFile": "03-section-section-24-24.png",
      "subLinks": []
    },
    {
      "name": "section-25",
      "url": "https://dicecontainers.com.ar/wp-content/uploads/2022/02/img010.jpg",
      "text": "",
      "screenshotFile": "03-section-section-25-25.png",
      "subLinks": []
    },
    {
      "name": "section-26",
      "url": "https://dicecontainers.com.ar/wp-content/uploads/2022/02/img09.jpg",
      "text": "",
      "screenshotFile": "03-section-section-26-26.png",
      "subLinks": []
    },
    {
      "name": "section-27",
      "url": "https://dicecontainers.com.ar/wp-content/uploads/2022/02/img08.jpg",
      "text": "",
      "screenshotFile": "03-section-section-27-27.png",
      "subLinks": []
    },
    {
      "name": "section-28",
      "url": "https://dicecontainers.com.ar/wp-content/uploads/2022/02/img07.jpg",
      "text": "",
      "screenshotFile": "03-section-section-28-28.png",
      "subLinks": []
    },
    {
      "name": "section-29",
      "url": "https://dicecontainers.com.ar/wp-content/uploads/2022/02/img06.jpg",
      "text": "",
      "screenshotFile": "03-section-section-29-29.png",
      "subLinks": []
    },
    {
      "name": "section-30",
      "url": "https://dicecontainers.com.ar/wp-content/uploads/2022/02/img05.jpg",
      "text": "",
      "screenshotFile": "03-section-section-30-30.png",
      "subLinks": []
    }
  ],
  "models": [
    {
      "name": "Casa Container 15m²",
      "url": "https://dicecontainers.com.ar/propiedades-dice/casa-container-15m%c2%b2/",
      "specs": [
        "1 Baño",
        "2 Baño",
        "1 Baño",
        "1 Baño",
        "1 Baño",
        "cocina",
        "comedor"
      ],
      "fullText": "Ir al contenido Home Propiedades Casa Container 15m² Casa Container 30m² Casa Container 60m² Casa Container 90m2 Quienes Somos Servicios Fabricación Habilitaciones Contratación Asesoramiento Opiniones Contacto Home Propiedades Casa Container 15m² Casa Container 30m² Casa Container 60m² Casa Container 90m2 Quienes Somos Servicios Fabricación Habilitaciones Contratación Asesoramiento Opiniones Contacto Home Propiedades Casa Container 15m² Casa Container 30m² Casa Container 60m² Casa Container 90m2 Quienes Somos Servicios Fabricación Habilitaciones Contratación Asesoramiento Opiniones Contacto Home Propiedades Casa Container 15m² Casa Container 30m² Casa Container 60m² Casa Container 90m2 Quienes Somos Servicios Fabricación Habilitaciones Contratación Asesoramiento Opiniones Contacto Home Propiedades Casa Container 15m² Casa Container 30m² Casa Container 60m² Casa Container 90m2 Quienes Somos Servicios Fabricación Habilitaciones Contratación Asesoramiento Opiniones Contacto Home Propiedades Casa Container 15m² Casa Container 30m² Casa Container 60m² Casa Container 90m2 Quienes Somos Servicios Fabricación Habilitaciones Contratación Asesoramiento Opiniones Contacto Casa Container 15m² 1 Ambiente/s 1 Baño/s Pies: 20 Largo: 6 mts. Ancho: 2.43 mts. Alto: 2.69 mts. Contado: USD 18369 + I.V.A. 10.5% o adelanto de USD 9184 + I.V.A. 10.5% + 72 cuotas de USD 247 + I.V.A. 10.5% o 72 cuotas de USD 494 + I.V.A. 10.5% Entrega e instalación en todo el país 100% Habilitables Ingeniero & Arquitecto Fabricación en planta especializada Dice Instalación en todo el país. Distribución: – Un (1) Mono ambiente, con ventana (0.8 mts x 2 mts) y persiana corrediza metálica con cierre interno, con bajo mesada de 100cm mesada y alacena de 100cm. Una (1) ventana (2.2 mts x 2.2 mts) y persianas metálicas con cierre interno. Una (1) Puerta (0.8 mts x 2 mts). – Un (1) baño completo, incluye inodoro con deposito exterior, bidetmatic, vanistorio y espejo, receptáculo ducho (120cm x 70cm) + media ampara vidrio, calefón electrico y ventana (50 cm x 100 cm), puerta placa de comunicación interior al pasillo. Terminaciones: – Pintura exterior poliuretano color Negro. – Revestimiento térmico interior de lana de vidrio. Revestimiento de terminación mdf 9mm pintado. – Revestimiento Baño durlock 9mm pintado blanco. – Conexiones de agua fría y caliente con sus respectivos artículos de funcionamiento, conexiones mediante caños de pvc unidos por termo fusión. – Conexión eléctrica interior embutida, distribuida a través de tubos corrugados ignífugos, iluminación led, con 2 plafones en cocina comedor, dos plafones en baño. Cuenta con luces exterior. tomas y puntos correspondientes a cada habitación. Incluye térmica y disyuntor. – Pisos flotantes (7mm) madera. – Aberturas en aluminio blanco línea Módena. – Un (1) Aire acondicionado frio calor de 2000fg. Plano Propiedad: Casa Container 15m² Casa Container 90m2 5 Amb 2 Baño ver más Casa Container 60m² 4 Amb 1 Baño ver más Casa Container 30m² 2 Amb 1 Baño ver más Casa Container 15m² 1 Amb 1 Baño ver más Consultanos por whatsapp Con sólo un click +54 9 341 675-6601 Tu próximo proyecto, comienza contactándonos! Paulo VI 670 2124 Villa Gobernador Galvez - Santa Fe +54 9 341 675-6601 dicecontainers@gmail.com Lunes A Viernes de 8:00 a 16:00 Hs",
      "screenshotFile": "03-section-casa-container-15m-1.png",
      "m2": "15m²",
      "price": "USD 18369",
      "rooms": "1 Ambiente"
    },
    {
      "name": "Casa Container 30m²",
      "url": "https://dicecontainers.com.ar/propiedades-dice/casa-container-30m%c2%b2/",
      "specs": [
        "1 Baño",
        "2 Baño",
        "1 Baño",
        "1 Baño",
        "1 Baño",
        "cocina",
        "comedor",
        "Cocina",
        "comedor",
        "cocina",
        "comedor"
      ],
      "fullText": "Ir al contenido Home Propiedades Casa Container 15m² Casa Container 30m² Casa Container 60m² Casa Container 90m2 Quienes Somos Servicios Fabricación Habilitaciones Contratación Asesoramiento Opiniones Contacto Home Propiedades Casa Container 15m² Casa Container 30m² Casa Container 60m² Casa Container 90m2 Quienes Somos Servicios Fabricación Habilitaciones Contratación Asesoramiento Opiniones Contacto Home Propiedades Casa Container 15m² Casa Container 30m² Casa Container 60m² Casa Container 90m2 Quienes Somos Servicios Fabricación Habilitaciones Contratación Asesoramiento Opiniones Contacto Home Propiedades Casa Container 15m² Casa Container 30m² Casa Container 60m² Casa Container 90m2 Quienes Somos Servicios Fabricación Habilitaciones Contratación Asesoramiento Opiniones Contacto Home Propiedades Casa Container 15m² Casa Container 30m² Casa Container 60m² Casa Container 90m2 Quienes Somos Servicios Fabricación Habilitaciones Contratación Asesoramiento Opiniones Contacto Home Propiedades Casa Container 15m² Casa Container 30m² Casa Container 60m² Casa Container 90m2 Quienes Somos Servicios Fabricación Habilitaciones Contratación Asesoramiento Opiniones Contacto Casa Container 30m² 2 Ambiente/s 1 Baño/s Pies: 40 Largo: 6 mts. Ancho: 4.86 mts. Alto: 2.69 mts. Contado: USD 26740 + I.V.A. 10.5% o adelanto de USD 13370 + I.V.A. 10.5% + 72 cuotas de USD 301 + I.V.A. 10.5% o 72 cuotas de USD 603 + I.V.A. 10.5% Entrega e instalación en todo el país 100% Habilitables Ingeniero & Arquitecto Fabricación en planta especializada Dice Instalación en todo el país. Distribución: – Un (1) dormitorio, con ventana (0.8 mts x 2 mts) y persiana corrediza metálica con cierre interno, puerta corrediza de comunicación a la cocina comedor. – Un (1) baño completo, incluye inodoro con deposito exterior, bidetmatic, vanistorio y espejo, receptáculo ducho (120cm x 70cm) + media ampara vidrio, calefón electrico y ventana (50 cm x 100 cm), puerta placa de comunicación interior al pasillo. – Una (1) Cocina comedor, con bajo mesada de 120cm mesada y alacena de 120cm. Dos (2) ventanas (2.2 mts x 2.2 mts) y persianas metálicas con cierre interno. Una (1) Puerta (0.8 mts x 2 mts). Terminaciones: – Pintura exterior poliuretano color Negro. – Revestimiento térmico interior de lana de vidrio. Revestimiento de terminación mdf 9mm pintado. – Revestimiento Baño durlock 9mm pintado blanco. – Conexiones de agua fría y caliente con sus respectivos artículos de funcionamiento, conexiones mediante caños de pvc unidos por termo fusión. – Conexión eléctrica interior embutida, distribuida a través de tubos corrugados ignífugos, iluminación led, con 2 plafones en cocina comedor, dos plafones en baño y un plafón en dormitorio. Cuenta con luces exterior. tomas y puntos correspondientes a cada habitación. Incluye térmica y disyuntor. – Pisos flotantes (7mm) madera. – Aberturas en aluminio blanco línea Módena. – Un (1) Aire acondicionado frio calor de 2000fg. Plano Propiedad: Casa Container 30m² Casa Container 90m2 5 Amb 2 Baño ver más Casa Container 60m² 4 Amb 1 Baño ver más Casa Container 30m² 2 Amb 1 Baño ver más Casa Container 15m² 1 Amb 1 Baño ver más Consultanos por whatsapp Con sólo un click +54 9 341 675-6601 Tu próximo proyecto, comienza contactándonos! Paulo VI 670 2124 Villa Gobernador Galvez - Santa Fe +54 9 341 675-6601 dicecontainers@gmail.com Lunes A Viernes de 8:00 a 16:00 Hs",
      "screenshotFile": "03-section-casa-container-30m-2.png",
      "m2": "15m²",
      "price": "USD 26740",
      "rooms": "2 Ambiente"
    },
    {
      "name": "Casa Container 60m²",
      "url": "https://dicecontainers.com.ar/propiedades-dice/casa-container-60m%c2%b2/",
      "specs": [
        "1 Baño",
        "2 Baño",
        "1 Baño",
        "1 Baño",
        "1 Baño",
        "living",
        "Cocina",
        "living",
        "comedor",
        "cocina",
        "comedor"
      ],
      "fullText": "Ir al contenido Home Propiedades Casa Container 15m² Casa Container 30m² Casa Container 60m² Casa Container 90m2 Quienes Somos Servicios Fabricación Habilitaciones Contratación Asesoramiento Opiniones Contacto Home Propiedades Casa Container 15m² Casa Container 30m² Casa Container 60m² Casa Container 90m2 Quienes Somos Servicios Fabricación Habilitaciones Contratación Asesoramiento Opiniones Contacto Home Propiedades Casa Container 15m² Casa Container 30m² Casa Container 60m² Casa Container 90m2 Quienes Somos Servicios Fabricación Habilitaciones Contratación Asesoramiento Opiniones Contacto Home Propiedades Casa Container 15m² Casa Container 30m² Casa Container 60m² Casa Container 90m2 Quienes Somos Servicios Fabricación Habilitaciones Contratación Asesoramiento Opiniones Contacto Home Propiedades Casa Container 15m² Casa Container 30m² Casa Container 60m² Casa Container 90m2 Quienes Somos Servicios Fabricación Habilitaciones Contratación Asesoramiento Opiniones Contacto Home Propiedades Casa Container 15m² Casa Container 30m² Casa Container 60m² Casa Container 90m2 Quienes Somos Servicios Fabricación Habilitaciones Contratación Asesoramiento Opiniones Contacto Casa Container 60m² 4 Ambiente/s 1 Baño/s Pies: 80 Largo: 12 mts. Ancho: 4.86 mts. Alto: 2.89 mts. Contado: USD 44463 + I.V.A. 10.5% o adelanto de USD 22232 + I.V.A. 10.5% + 72 cuotas de USD 596 + I.V.A. 10.5% o 72 cuotas de USD 1196 + I.V.A. 10.5% Entrega e instalación en todo el país 100% Habilitables Ingeniero & Arquitecto Fabricación en planta especializada Dice Instalación en todo el país. Distribución: – Dos (2) dormitorio, con ventana (0.8 mts x 2 mts) y persiana corrediza metálica con cierre interno, puerta placa de comunicación interior al pasillo. Placar (1mts) puertas corredizas. Uno de los dormitorios cuenta con puerta corrediza de comunicación al living para su posible uso como estudio. – Un (1) baño completo, incluye inodoro con deposito exterior, bidet, receptáculo ducho (150cm x 70cm) + media ampara vidrio, calefón eléctrico y ventana (50 cm x 100 cm), puerta placa de comunicación al ante baño. – Un (1) ante baño con vanistorio y puerta de comunicación al baño y otra al pasillo. – Una (1) Cocina, con bajo mesada de 180 cm mesada y alacena de 120cm. Una (1) ventanas corredizas (1.5 mts x 0.5 mts) y persianas corredizas metálica con cierre interno. – Un (1) living comedor con Dos (2) ventanas (2.2 mts x 2.2 mts) con persiana metálica. Una (1) puerta (0.8 mts x 2 mts). Una ventana (1.8 mts x 2 mts) y persianas corredizas metálica con cierre interno. Terminaciones: – Pintura exterior poliuretano color elección. – Revestimiento térmico interior de lana de vidrio. Revestimiento de terminación mdf 9mm pintado. – Revestimiento Baño durlock 9mm pintado blanco. – Conexiones de agua fria y caliente con sus respectivos artículos de funcionamiento, conexiones mediante caños de pvc unidos por termo fusión. – Conexión eléctrica interior embutida, distribuida a través de tubos corrugados ignífugos, iluminación led, con 6 plafones en cocina comedor, dos plafones en baño y un plafón en dormitorio. Cuenta con luces exterior. tomas y puntos correspondientes a cada habitación. Incluye térmica y disyuntor. – Pisos flotantes (7mm) madera. – Aberturas en aluminio blanco línea Módena. – Dos (2) Aire acondicionado frio calor de 2000fg. Plano Propiedad: Casa Container 60m² Casa Container 90m2 5 Amb 2 Baño ver más Casa Container 60m² 4 Amb 1 Baño ver más Casa Container 30m² 2 Amb 1 Baño ver más Casa Container 15m² 1 Amb 1 Baño ver más Consultanos por whatsapp Con sólo un click +54 9 341 675-6601 Tu próximo proyecto, comienza contactándonos! Paulo VI 670 2124 Villa Gobernador Galvez - Santa Fe +54 9 341 675-6601 dicecontainers@gmail.com Lunes A Viernes de 8:00 a 16:00 Hs",
      "screenshotFile": "03-section-casa-container-60m-3.png",
      "m2": "15m²",
      "price": "USD 44463",
      "rooms": "4 Ambiente"
    },
    {
      "name": "Casa Container 90m2",
      "url": "https://dicecontainers.com.ar/propiedades-dice/casa-container-90m2/",
      "specs": [
        "2 Baño",
        "2 Baño",
        "1 Baño",
        "1 Baño",
        "1 Baño",
        "living",
        "Cocina",
        "living",
        "comedor",
        "cocina",
        "comedor"
      ],
      "fullText": "Ir al contenido Home Propiedades Casa Container 15m² Casa Container 30m² Casa Container 60m² Casa Container 90m2 Quienes Somos Servicios Fabricación Habilitaciones Contratación Asesoramiento Opiniones Contacto Home Propiedades Casa Container 15m² Casa Container 30m² Casa Container 60m² Casa Container 90m2 Quienes Somos Servicios Fabricación Habilitaciones Contratación Asesoramiento Opiniones Contacto Home Propiedades Casa Container 15m² Casa Container 30m² Casa Container 60m² Casa Container 90m2 Quienes Somos Servicios Fabricación Habilitaciones Contratación Asesoramiento Opiniones Contacto Home Propiedades Casa Container 15m² Casa Container 30m² Casa Container 60m² Casa Container 90m2 Quienes Somos Servicios Fabricación Habilitaciones Contratación Asesoramiento Opiniones Contacto Home Propiedades Casa Container 15m² Casa Container 30m² Casa Container 60m² Casa Container 90m2 Quienes Somos Servicios Fabricación Habilitaciones Contratación Asesoramiento Opiniones Contacto Home Propiedades Casa Container 15m² Casa Container 30m² Casa Container 60m² Casa Container 90m2 Quienes Somos Servicios Fabricación Habilitaciones Contratación Asesoramiento Opiniones Contacto Casa Container 90m2 5 Ambiente/s 2 Baño/s Pies: 120 Largo: 12 mts. Ancho: 7.29 mts. Alto: 2.89 mts. Contado: USD 65381 + I.V.A. 10.5% o adelanto de USD 32690 + I.V.A. 10.5% + 72 cuotas de USD 879 + I.V.A. 10.5% o 72 cuotas de USD 1758 + I.V.A. 10.5% Entrega e instalación en todo el país 100% Habilitables Ingeniero & Arquitecto Fabricación en planta especializada Dice Instalación en todo el país. Distribución: – Tres (3) dormitorio, con ventana (0.8 mts x 2 mts) y persiana corrediza metálica con cierre interno, puerta placa de comunicación interior al pasillo. Placar (1mts) puertas corredizas. Uno de los dormitorios cuenta con puerta corrediza de comunicación al living para su posible uso como estudio. Uno de los dormitorios cuenta con vestidor. – Un (1) baño completo, incluye inodoro con deposito exterior, bidetmatic, receptáculo ducho (150cm x 70cm) + media ampara vidrio, calefón eléctrico y ventana (50 cm x 100 cm), puerta placa de comunicación al cambiador. – Un (1) baño completo, incluye inodoro con deposito exterior, bidet, receptáculo ducho (150cm x 70cm) + media ampara vidrio, calefón eléctrico puerta placa de comunicación al ante baño. – Un (1) ante baño con vanistorio y puerta de comunicación al baño y otra al pasillo. – Una (1) Cocina, con bajo mesada de 180 cm mesada y alacena de 120cm. Una (1) ventanas corredizas (1.5 mts x 0.5 mts) y persianas corredizas metálica con cierre interno. – Un (1) living comedor con Dos (2) ventanas (2.2 mts x 2.2 mts) con persiana metálica. Una (1) puerta (0.8 mts x 2 mts). Una ventana (1.8 mts x 2 mts) y persianas corredizas metálica con cierre interno. Terminaciones: – Pintura exterior poliuretano color elección. – Revestimiento térmico interior de lana de vidrio. Revestimiento de terminación mdf 9mm pintado. – Revestimiento Baño durlock 9mm pintado blanco. – Conexiones de agua fria y caliente con sus respectivos artículos de funcionamiento, conexiones mediante caños de pvc unidos por termo fusión. – Conexión eléctrica interior embutida, distribuida a través de tubos corrugados ignífugos, iluminación led, con 6 plafones en cocina comedor, dos plafones en baño y un plafón en dormitorio. Cuenta con luces exterior. tomas y puntos correspondientes a cada habitación. Incluye térmica y disyuntor. – Pisos flotantes (7mm) madera. – Aberturas en aluminio blanco línea Módena. – Tres (3) Aire acondicionado frio calor de 2000fg. Plano Propiedad: Casa Container 90m2 Casa Container 90m2 5 Amb 2 Baño ver más Casa Container 60m² 4 Amb 1 Baño ver más Casa Container 30m² 2 Amb 1 Baño ver más Casa Container 15m² 1 Amb 1 Baño ver más Consultanos por whatsapp Con sólo un click +54 9 341 675-6601 Tu próximo proyecto, comienza contactándonos! Paulo VI 670 2124 Villa Gobernador Galvez - Santa Fe +54 9 341 675-6601 dicecontainers@gmail.com Lunes A Viernes de 8:00 a 16:00 Hs",
      "screenshotFile": "03-section-casa-container-90m2-4.png",
      "m2": "15m²",
      "price": "USD 65381",
      "rooms": "5 Ambiente"
    },
    {
      "name": "CASAS CONTAINERHASTA 72 CUOTAS FIJASVER MÁS",
      "url": "https://dicecontainers.com.ar/propiedades-dice/",
      "specs": [
        "2 Baño",
        "1 Baño",
        "1 Baño",
        "1 Baño"
      ],
      "fullText": "Ir al contenido Home Propiedades Casa Container 15m² Casa Container 30m² Casa Container 60m² Casa Container 90m2 Quienes Somos Servicios Fabricación Habilitaciones Contratación Asesoramiento Opiniones Contacto Home Propiedades Casa Container 15m² Casa Container 30m² Casa Container 60m² Casa Container 90m2 Quienes Somos Servicios Fabricación Habilitaciones Contratación Asesoramiento Opiniones Contacto Home Propiedades Casa Container 15m² Casa Container 30m² Casa Container 60m² Casa Container 90m2 Quienes Somos Servicios Fabricación Habilitaciones Contratación Asesoramiento Opiniones Contacto Home Propiedades Casa Container 15m² Casa Container 30m² Casa Container 60m² Casa Container 90m2 Quienes Somos Servicios Fabricación Habilitaciones Contratación Asesoramiento Opiniones Contacto Home Propiedades Casa Container 15m² Casa Container 30m² Casa Container 60m² Casa Container 90m2 Quienes Somos Servicios Fabricación Habilitaciones Contratación Asesoramiento Opiniones Contacto Home Propiedades Casa Container 15m² Casa Container 30m² Casa Container 60m² Casa Container 90m2 Quienes Somos Servicios Fabricación Habilitaciones Contratación Asesoramiento Opiniones Contacto Propiedades Dice Casa Container 90m2 5 Amb 2 Baño ver más Casa Container 60m² 4 Amb 1 Baño ver más Casa Container 30m² 2 Amb 1 Baño ver más Casa Container 15m² 1 Amb 1 Baño ver más Consultanos por whatsapp Con sólo un click +54 9 341 675-6601 Tu próximo proyecto, comienza contactándonos! Paulo VI 670 2124 Villa Gobernador Galvez - Santa Fe +54 9 341 675-6601 dicecontainers@gmail.com Lunes A Viernes de 8:00 a 16:00 Hs",
      "screenshotFile": "03-section-casas-containerhasta-72-cuotas-fijasver-m-s-5.png",
      "m2": "15m²"
    },
    {
      "name": "",
      "url": "https://dicecontainers.com.ar/wp-content/uploads/2022/06/1.jpg",
      "specs": [],
      "fullText": "",
      "screenshotFile": "04-model-.png"
    },
    {
      "name": "",
      "url": "https://dicecontainers.com.ar/wp-content/uploads/2022/02/IMG_0357-2.jpg",
      "specs": [],
      "fullText": "",
      "screenshotFile": "04-model-.png"
    },
    {
      "name": "",
      "url": "https://dicecontainers.com.ar/wp-content/uploads/2022/02/20210916_181540-2.jpg",
      "specs": [],
      "fullText": "",
      "screenshotFile": "04-model-.png"
    },
    {
      "name": "",
      "url": "https://dicecontainers.com.ar/wp-content/uploads/2022/02/20210916_165914-2.jpg",
      "specs": [],
      "fullText": "",
      "screenshotFile": "04-model-.png"
    },
    {
      "name": "",
      "url": "https://dicecontainers.com.ar/wp-content/uploads/2022/02/20210916_182259-2.jpg",
      "specs": [],
      "fullText": "",
      "screenshotFile": "04-model-.png"
    },
    {
      "name": "",
      "url": "https://dicecontainers.com.ar/wp-content/uploads/2022/02/20210916_181705.jpg",
      "specs": [],
      "fullText": "",
      "screenshotFile": "04-model-.png"
    },
    {
      "name": "",
      "url": "https://dicecontainers.com.ar/wp-content/uploads/2022/02/7704baae-cf88-4f26-8a49-355b89436b4a.jpg",
      "specs": [],
      "fullText": "",
      "screenshotFile": "04-model-.png"
    },
    {
      "name": "",
      "url": "https://dicecontainers.com.ar/wp-content/uploads/2022/02/d4906302-de73-40b1-b1a5-dd88db39cfa5.jpg",
      "specs": [],
      "fullText": "",
      "screenshotFile": "04-model-.png"
    },
    {
      "name": "",
      "url": "https://dicecontainers.com.ar/wp-content/uploads/2023/06/003.png",
      "specs": [],
      "fullText": "",
      "screenshotFile": "04-model-.png"
    },
    {
      "name": "",
      "url": "https://dicecontainers.com.ar/wp-content/uploads/2023/06/000.png",
      "specs": [],
      "fullText": "",
      "screenshotFile": "04-model-.png"
    },
    {
      "name": "",
      "url": "https://dicecontainers.com.ar/wp-content/uploads/2023/06/20230317_133217-scaled.jpg",
      "specs": [],
      "fullText": "",
      "screenshotFile": "04-model-.png"
    },
    {
      "name": "",
      "url": "https://dicecontainers.com.ar/wp-content/uploads/2023/06/20230317_133107-scaled.jpg",
      "specs": [],
      "fullText": "",
      "screenshotFile": "04-model-.png"
    },
    {
      "name": "",
      "url": "https://dicecontainers.com.ar/wp-content/uploads/2023/06/20230317_142218-scaled.jpg",
      "specs": [],
      "fullText": "",
      "screenshotFile": "04-model-.png"
    },
    {
      "name": "",
      "url": "https://dicecontainers.com.ar/wp-content/uploads/2023/06/20230317_132941-1-scaled.jpg",
      "specs": [],
      "fullText": "",
      "screenshotFile": "04-model-.png"
    },
    {
      "name": "",
      "url": "https://dicecontainers.com.ar/wp-content/uploads/2023/06/20230317_142243-scaled.jpg",
      "specs": [],
      "fullText": "",
      "screenshotFile": "04-model-.png"
    },
    {
      "name": "",
      "url": "https://dicecontainers.com.ar/wp-content/uploads/2023/06/20230317_142342.png",
      "specs": [],
      "fullText": "",
      "screenshotFile": "04-model-.png"
    },
    {
      "name": "",
      "url": "https://dicecontainers.com.ar/wp-content/uploads/2023/06/20230317_133100-scaled.jpg",
      "specs": [],
      "fullText": "",
      "screenshotFile": "04-model-.png"
    },
    {
      "name": "",
      "url": "https://dicecontainers.com.ar/wp-content/uploads/2023/06/20230317_132934-scaled.jpg",
      "specs": [],
      "fullText": "",
      "screenshotFile": "04-model-.png"
    },
    {
      "name": "",
      "url": "https://dicecontainers.com.ar/wp-content/uploads/2023/06/20230317_133022-scaled.jpg",
      "specs": [],
      "fullText": "",
      "screenshotFile": "04-model-.png"
    },
    {
      "name": "",
      "url": "https://dicecontainers.com.ar/wp-content/uploads/2023/06/20230317_133117-scaled.jpg",
      "specs": [],
      "fullText": "",
      "screenshotFile": "04-model-.png"
    },
    {
      "name": "",
      "url": "https://dicecontainers.com.ar/wp-content/uploads/2023/06/20230317_133042-scaled.jpg",
      "specs": [],
      "fullText": "",
      "screenshotFile": "04-model-.png"
    },
    {
      "name": "",
      "url": "https://dicecontainers.com.ar/wp-content/uploads/2023/06/20230317_142404-scaled.jpg",
      "specs": [],
      "fullText": "",
      "screenshotFile": "04-model-.png"
    },
    {
      "name": "",
      "url": "https://dicecontainers.com.ar/wp-content/uploads/2023/06/20230317_142243-1-scaled.jpg",
      "specs": [],
      "fullText": "",
      "screenshotFile": "04-model-.png"
    },
    {
      "name": "",
      "url": "https://dicecontainers.com.ar/wp-content/uploads/2023/06/WhatsApp-Image-2023-06-12-at-18.28.39-2.jpeg",
      "specs": [],
      "fullText": "",
      "screenshotFile": "04-model-.png"
    },
    {
      "name": "",
      "url": "https://dicecontainers.com.ar/wp-content/uploads/2023/06/WhatsApp-Image-2023-06-12-at-18.29.03.jpeg",
      "specs": [],
      "fullText": "",
      "screenshotFile": "04-model-.png"
    },
    {
      "name": "",
      "url": "https://dicecontainers.com.ar/wp-content/uploads/2023/06/WhatsApp-Image-2023-06-12-at-18.28.39-1.jpeg",
      "specs": [],
      "fullText": "",
      "screenshotFile": "04-model-.png"
    },
    {
      "name": "",
      "url": "https://dicecontainers.com.ar/wp-content/uploads/2023/06/WhatsApp-Image-2023-06-12-at-18.28.39-3.jpeg",
      "specs": [],
      "fullText": "",
      "screenshotFile": "04-model-.png"
    },
    {
      "name": "",
      "url": "https://dicecontainers.com.ar/wp-content/uploads/2023/06/WhatsApp-Image-2023-06-12-at-18.28.39.jpeg",
      "specs": [],
      "fullText": "",
      "screenshotFile": "04-model-.png"
    },
    {
      "name": "Ir al contenido",
      "url": "https://dicecontainers.com.ar/propiedades-dice/casa-container-15m%c2%b2/#content",
      "specs": [
        "1 Baño",
        "2 Baño",
        "1 Baño",
        "1 Baño",
        "1 Baño",
        "cocina",
        "comedor"
      ],
      "fullText": "Ir al contenido Home Propiedades Casa Container 15m² Casa Container 30m² Casa Container 60m² Casa Container 90m2 Quienes Somos Servicios Fabricación Habilitaciones Contratación Asesoramiento Opiniones Contacto Home Propiedades Casa Container 15m² Casa Container 30m² Casa Container 60m² Casa Container 90m2 Quienes Somos Servicios Fabricación Habilitaciones Contratación Asesoramiento Opiniones Contacto Home Propiedades Casa Container 15m² Casa Container 30m² Casa Container 60m² Casa Container 90m2 Quienes Somos Servicios Fabricación Habilitaciones Contratación Asesoramiento Opiniones Contacto Home Propiedades Casa Container 15m² Casa Container 30m² Casa Container 60m² Casa Container 90m2 Quienes Somos Servicios Fabricación Habilitaciones Contratación Asesoramiento Opiniones Contacto Home Propiedades Casa Container 15m² Casa Container 30m² Casa Container 60m² Casa Container 90m2 Quienes Somos Servicios Fabricación Habilitaciones Contratación Asesoramiento Opiniones Contacto Home Propiedades Casa Container 15m² Casa Container 30m² Casa Container 60m² Casa Container 90m2 Quienes Somos Servicios Fabricación Habilitaciones Contratación Asesoramiento Opiniones Contacto Casa Container 15m² 1 Ambiente/s 1 Baño/s Pies: 20 Largo: 6 mts. Ancho: 2.43 mts. Alto: 2.69 mts. Contado: USD 18369 + I.V.A. 10.5% o adelanto de USD 9184 + I.V.A. 10.5% + 72 cuotas de USD 247 + I.V.A. 10.5% o 72 cuotas de USD 494 + I.V.A. 10.5% Entrega e instalación en todo el país 100% Habilitables Ingeniero & Arquitecto Fabricación en planta especializada Dice Instalación en todo el país. Distribución: – Un (1) Mono ambiente, con ventana (0.8 mts x 2 mts) y persiana corrediza metálica con cierre interno, con bajo mesada de 100cm mesada y alacena de 100cm. Una (1) ventana (2.2 mts x 2.2 mts) y persianas metálicas con cierre interno. Una (1) Puerta (0.8 mts x 2 mts). – Un (1) baño completo, incluye inodoro con deposito exterior, bidetmatic, vanistorio y espejo, receptáculo ducho (120cm x 70cm) + media ampara vidrio, calefón electrico y ventana (50 cm x 100 cm), puerta placa de comunicación interior al pasillo. Terminaciones: – Pintura exterior poliuretano color Negro. – Revestimiento térmico interior de lana de vidrio. Revestimiento de terminación mdf 9mm pintado. – Revestimiento Baño durlock 9mm pintado blanco. – Conexiones de agua fría y caliente con sus respectivos artículos de funcionamiento, conexiones mediante caños de pvc unidos por termo fusión. – Conexión eléctrica interior embutida, distribuida a través de tubos corrugados ignífugos, iluminación led, con 2 plafones en cocina comedor, dos plafones en baño. Cuenta con luces exterior. tomas y puntos correspondientes a cada habitación. Incluye térmica y disyuntor. – Pisos flotantes (7mm) madera. – Aberturas en aluminio blanco línea Módena. – Un (1) Aire acondicionado frio calor de 2000fg. Plano Propiedad: Casa Container 15m² Casa Container 90m2 5 Amb 2 Baño ver más Casa Container 60m² 4 Amb 1 Baño ver más Casa Container 30m² 2 Amb 1 Baño ver más Casa Container 15m² 1 Amb 1 Baño ver más Consultanos por whatsapp Con sólo un click +54 9 341 675-6601 Tu próximo proyecto, comienza contactándonos! Paulo VI 670 2124 Villa Gobernador Galvez - Santa Fe +54 9 341 675-6601 dicecontainers@gmail.com Lunes A Viernes de 8:00 a 16:00 Hs",
      "screenshotFile": "03-section-casa-container-15m-1.png",
      "m2": "15m²",
      "price": "USD 18369",
      "rooms": "1 Ambiente"
    },
    {
      "name": "Servicios",
      "url": "https://dicecontainers.com.ar/propiedades-dice/casa-container-15m%c2%b2/#",
      "specs": [
        "1 Baño",
        "2 Baño",
        "1 Baño",
        "1 Baño",
        "1 Baño",
        "cocina",
        "comedor"
      ],
      "fullText": "Ir al contenido Home Propiedades Casa Container 15m² Casa Container 30m² Casa Container 60m² Casa Container 90m2 Quienes Somos Servicios Fabricación Habilitaciones Contratación Asesoramiento Opiniones Contacto Home Propiedades Casa Container 15m² Casa Container 30m² Casa Container 60m² Casa Container 90m2 Quienes Somos Servicios Fabricación Habilitaciones Contratación Asesoramiento Opiniones Contacto Home Propiedades Casa Container 15m² Casa Container 30m² Casa Container 60m² Casa Container 90m2 Quienes Somos Servicios Fabricación Habilitaciones Contratación Asesoramiento Opiniones Contacto Home Propiedades Casa Container 15m² Casa Container 30m² Casa Container 60m² Casa Container 90m2 Quienes Somos Servicios Fabricación Habilitaciones Contratación Asesoramiento Opiniones Contacto Home Propiedades Casa Container 15m² Casa Container 30m² Casa Container 60m² Casa Container 90m2 Quienes Somos Servicios Fabricación Habilitaciones Contratación Asesoramiento Opiniones Contacto Home Propiedades Casa Container 15m² Casa Container 30m² Casa Container 60m² Casa Container 90m2 Quienes Somos Servicios Fabricación Habilitaciones Contratación Asesoramiento Opiniones Contacto Casa Container 15m² 1 Ambiente/s 1 Baño/s Pies: 20 Largo: 6 mts. Ancho: 2.43 mts. Alto: 2.69 mts. Contado: USD 18369 + I.V.A. 10.5% o adelanto de USD 9184 + I.V.A. 10.5% + 72 cuotas de USD 247 + I.V.A. 10.5% o 72 cuotas de USD 494 + I.V.A. 10.5% Entrega e instalación en todo el país 100% Habilitables Ingeniero & Arquitecto Fabricación en planta especializada Dice Instalación en todo el país. Distribución: – Un (1) Mono ambiente, con ventana (0.8 mts x 2 mts) y persiana corrediza metálica con cierre interno, con bajo mesada de 100cm mesada y alacena de 100cm. Una (1) ventana (2.2 mts x 2.2 mts) y persianas metálicas con cierre interno. Una (1) Puerta (0.8 mts x 2 mts). – Un (1) baño completo, incluye inodoro con deposito exterior, bidetmatic, vanistorio y espejo, receptáculo ducho (120cm x 70cm) + media ampara vidrio, calefón electrico y ventana (50 cm x 100 cm), puerta placa de comunicación interior al pasillo. Terminaciones: – Pintura exterior poliuretano color Negro. – Revestimiento térmico interior de lana de vidrio. Revestimiento de terminación mdf 9mm pintado. – Revestimiento Baño durlock 9mm pintado blanco. – Conexiones de agua fría y caliente con sus respectivos artículos de funcionamiento, conexiones mediante caños de pvc unidos por termo fusión. – Conexión eléctrica interior embutida, distribuida a través de tubos corrugados ignífugos, iluminación led, con 2 plafones en cocina comedor, dos plafones en baño. Cuenta con luces exterior. tomas y puntos correspondientes a cada habitación. Incluye térmica y disyuntor. – Pisos flotantes (7mm) madera. – Aberturas en aluminio blanco línea Módena. – Un (1) Aire acondicionado frio calor de 2000fg. Plano Propiedad: Casa Container 15m² Casa Container 90m2 5 Amb 2 Baño ver más Casa Container 60m² 4 Amb 1 Baño ver más Casa Container 30m² 2 Amb 1 Baño ver más Casa Container 15m² 1 Amb 1 Baño ver más Consultanos por whatsapp Con sólo un click +54 9 341 675-6601 Tu próximo proyecto, comienza contactándonos! Paulo VI 670 2124 Villa Gobernador Galvez - Santa Fe +54 9 341 675-6601 dicecontainers@gmail.com Lunes A Viernes de 8:00 a 16:00 Hs",
      "screenshotFile": "03-section-casa-container-15m-1.png",
      "m2": "15m²",
      "price": "USD 18369",
      "rooms": "1 Ambiente"
    },
    {
      "name": "Ir al contenido",
      "url": "https://dicecontainers.com.ar/propiedades-dice/casa-container-30m%c2%b2/#content",
      "specs": [
        "1 Baño",
        "2 Baño",
        "1 Baño",
        "1 Baño",
        "1 Baño",
        "cocina",
        "comedor",
        "Cocina",
        "comedor",
        "cocina",
        "comedor"
      ],
      "fullText": "Ir al contenido Home Propiedades Casa Container 15m² Casa Container 30m² Casa Container 60m² Casa Container 90m2 Quienes Somos Servicios Fabricación Habilitaciones Contratación Asesoramiento Opiniones Contacto Home Propiedades Casa Container 15m² Casa Container 30m² Casa Container 60m² Casa Container 90m2 Quienes Somos Servicios Fabricación Habilitaciones Contratación Asesoramiento Opiniones Contacto Home Propiedades Casa Container 15m² Casa Container 30m² Casa Container 60m² Casa Container 90m2 Quienes Somos Servicios Fabricación Habilitaciones Contratación Asesoramiento Opiniones Contacto Home Propiedades Casa Container 15m² Casa Container 30m² Casa Container 60m² Casa Container 90m2 Quienes Somos Servicios Fabricación Habilitaciones Contratación Asesoramiento Opiniones Contacto Home Propiedades Casa Container 15m² Casa Container 30m² Casa Container 60m² Casa Container 90m2 Quienes Somos Servicios Fabricación Habilitaciones Contratación Asesoramiento Opiniones Contacto Home Propiedades Casa Container 15m² Casa Container 30m² Casa Container 60m² Casa Container 90m2 Quienes Somos Servicios Fabricación Habilitaciones Contratación Asesoramiento Opiniones Contacto Casa Container 30m² 2 Ambiente/s 1 Baño/s Pies: 40 Largo: 6 mts. Ancho: 4.86 mts. Alto: 2.69 mts. Contado: USD 26740 + I.V.A. 10.5% o adelanto de USD 13370 + I.V.A. 10.5% + 72 cuotas de USD 301 + I.V.A. 10.5% o 72 cuotas de USD 603 + I.V.A. 10.5% Entrega e instalación en todo el país 100% Habilitables Ingeniero & Arquitecto Fabricación en planta especializada Dice Instalación en todo el país. Distribución: – Un (1) dormitorio, con ventana (0.8 mts x 2 mts) y persiana corrediza metálica con cierre interno, puerta corrediza de comunicación a la cocina comedor. – Un (1) baño completo, incluye inodoro con deposito exterior, bidetmatic, vanistorio y espejo, receptáculo ducho (120cm x 70cm) + media ampara vidrio, calefón electrico y ventana (50 cm x 100 cm), puerta placa de comunicación interior al pasillo. – Una (1) Cocina comedor, con bajo mesada de 120cm mesada y alacena de 120cm. Dos (2) ventanas (2.2 mts x 2.2 mts) y persianas metálicas con cierre interno. Una (1) Puerta (0.8 mts x 2 mts). Terminaciones: – Pintura exterior poliuretano color Negro. – Revestimiento térmico interior de lana de vidrio. Revestimiento de terminación mdf 9mm pintado. – Revestimiento Baño durlock 9mm pintado blanco. – Conexiones de agua fría y caliente con sus respectivos artículos de funcionamiento, conexiones mediante caños de pvc unidos por termo fusión. – Conexión eléctrica interior embutida, distribuida a través de tubos corrugados ignífugos, iluminación led, con 2 plafones en cocina comedor, dos plafones en baño y un plafón en dormitorio. Cuenta con luces exterior. tomas y puntos correspondientes a cada habitación. Incluye térmica y disyuntor. – Pisos flotantes (7mm) madera. – Aberturas en aluminio blanco línea Módena. – Un (1) Aire acondicionado frio calor de 2000fg. Plano Propiedad: Casa Container 30m² Casa Container 90m2 5 Amb 2 Baño ver más Casa Container 60m² 4 Amb 1 Baño ver más Casa Container 30m² 2 Amb 1 Baño ver más Casa Container 15m² 1 Amb 1 Baño ver más Consultanos por whatsapp Con sólo un click +54 9 341 675-6601 Tu próximo proyecto, comienza contactándonos! Paulo VI 670 2124 Villa Gobernador Galvez - Santa Fe +54 9 341 675-6601 dicecontainers@gmail.com Lunes A Viernes de 8:00 a 16:00 Hs",
      "screenshotFile": "03-section-casa-container-30m-2.png",
      "m2": "15m²",
      "price": "USD 26740",
      "rooms": "2 Ambiente"
    },
    {
      "name": "Servicios",
      "url": "https://dicecontainers.com.ar/propiedades-dice/casa-container-30m%c2%b2/#",
      "specs": [
        "1 Baño",
        "2 Baño",
        "1 Baño",
        "1 Baño",
        "1 Baño",
        "cocina",
        "comedor",
        "Cocina",
        "comedor",
        "cocina",
        "comedor"
      ],
      "fullText": "Ir al contenido Home Propiedades Casa Container 15m² Casa Container 30m² Casa Container 60m² Casa Container 90m2 Quienes Somos Servicios Fabricación Habilitaciones Contratación Asesoramiento Opiniones Contacto Home Propiedades Casa Container 15m² Casa Container 30m² Casa Container 60m² Casa Container 90m2 Quienes Somos Servicios Fabricación Habilitaciones Contratación Asesoramiento Opiniones Contacto Home Propiedades Casa Container 15m² Casa Container 30m² Casa Container 60m² Casa Container 90m2 Quienes Somos Servicios Fabricación Habilitaciones Contratación Asesoramiento Opiniones Contacto Home Propiedades Casa Container 15m² Casa Container 30m² Casa Container 60m² Casa Container 90m2 Quienes Somos Servicios Fabricación Habilitaciones Contratación Asesoramiento Opiniones Contacto Home Propiedades Casa Container 15m² Casa Container 30m² Casa Container 60m² Casa Container 90m2 Quienes Somos Servicios Fabricación Habilitaciones Contratación Asesoramiento Opiniones Contacto Home Propiedades Casa Container 15m² Casa Container 30m² Casa Container 60m² Casa Container 90m2 Quienes Somos Servicios Fabricación Habilitaciones Contratación Asesoramiento Opiniones Contacto Casa Container 30m² 2 Ambiente/s 1 Baño/s Pies: 40 Largo: 6 mts. Ancho: 4.86 mts. Alto: 2.69 mts. Contado: USD 26740 + I.V.A. 10.5% o adelanto de USD 13370 + I.V.A. 10.5% + 72 cuotas de USD 301 + I.V.A. 10.5% o 72 cuotas de USD 603 + I.V.A. 10.5% Entrega e instalación en todo el país 100% Habilitables Ingeniero & Arquitecto Fabricación en planta especializada Dice Instalación en todo el país. Distribución: – Un (1) dormitorio, con ventana (0.8 mts x 2 mts) y persiana corrediza metálica con cierre interno, puerta corrediza de comunicación a la cocina comedor. – Un (1) baño completo, incluye inodoro con deposito exterior, bidetmatic, vanistorio y espejo, receptáculo ducho (120cm x 70cm) + media ampara vidrio, calefón electrico y ventana (50 cm x 100 cm), puerta placa de comunicación interior al pasillo. – Una (1) Cocina comedor, con bajo mesada de 120cm mesada y alacena de 120cm. Dos (2) ventanas (2.2 mts x 2.2 mts) y persianas metálicas con cierre interno. Una (1) Puerta (0.8 mts x 2 mts). Terminaciones: – Pintura exterior poliuretano color Negro. – Revestimiento térmico interior de lana de vidrio. Revestimiento de terminación mdf 9mm pintado. – Revestimiento Baño durlock 9mm pintado blanco. – Conexiones de agua fría y caliente con sus respectivos artículos de funcionamiento, conexiones mediante caños de pvc unidos por termo fusión. – Conexión eléctrica interior embutida, distribuida a través de tubos corrugados ignífugos, iluminación led, con 2 plafones en cocina comedor, dos plafones en baño y un plafón en dormitorio. Cuenta con luces exterior. tomas y puntos correspondientes a cada habitación. Incluye térmica y disyuntor. – Pisos flotantes (7mm) madera. – Aberturas en aluminio blanco línea Módena. – Un (1) Aire acondicionado frio calor de 2000fg. Plano Propiedad: Casa Container 30m² Casa Container 90m2 5 Amb 2 Baño ver más Casa Container 60m² 4 Amb 1 Baño ver más Casa Container 30m² 2 Amb 1 Baño ver más Casa Container 15m² 1 Amb 1 Baño ver más Consultanos por whatsapp Con sólo un click +54 9 341 675-6601 Tu próximo proyecto, comienza contactándonos! Paulo VI 670 2124 Villa Gobernador Galvez - Santa Fe +54 9 341 675-6601 dicecontainers@gmail.com Lunes A Viernes de 8:00 a 16:00 Hs",
      "screenshotFile": "03-section-casa-container-30m-2.png",
      "m2": "15m²",
      "price": "USD 26740",
      "rooms": "2 Ambiente"
    },
    {
      "name": "Ir al contenido",
      "url": "https://dicecontainers.com.ar/propiedades-dice/casa-container-60m%c2%b2/#content",
      "specs": [
        "1 Baño",
        "2 Baño",
        "1 Baño",
        "1 Baño",
        "1 Baño",
        "living",
        "Cocina",
        "living",
        "comedor",
        "cocina",
        "comedor"
      ],
      "fullText": "Ir al contenido Home Propiedades Casa Container 15m² Casa Container 30m² Casa Container 60m² Casa Container 90m2 Quienes Somos Servicios Fabricación Habilitaciones Contratación Asesoramiento Opiniones Contacto Home Propiedades Casa Container 15m² Casa Container 30m² Casa Container 60m² Casa Container 90m2 Quienes Somos Servicios Fabricación Habilitaciones Contratación Asesoramiento Opiniones Contacto Home Propiedades Casa Container 15m² Casa Container 30m² Casa Container 60m² Casa Container 90m2 Quienes Somos Servicios Fabricación Habilitaciones Contratación Asesoramiento Opiniones Contacto Home Propiedades Casa Container 15m² Casa Container 30m² Casa Container 60m² Casa Container 90m2 Quienes Somos Servicios Fabricación Habilitaciones Contratación Asesoramiento Opiniones Contacto Home Propiedades Casa Container 15m² Casa Container 30m² Casa Container 60m² Casa Container 90m2 Quienes Somos Servicios Fabricación Habilitaciones Contratación Asesoramiento Opiniones Contacto Home Propiedades Casa Container 15m² Casa Container 30m² Casa Container 60m² Casa Container 90m2 Quienes Somos Servicios Fabricación Habilitaciones Contratación Asesoramiento Opiniones Contacto Casa Container 60m² 4 Ambiente/s 1 Baño/s Pies: 80 Largo: 12 mts. Ancho: 4.86 mts. Alto: 2.89 mts. Contado: USD 44463 + I.V.A. 10.5% o adelanto de USD 22232 + I.V.A. 10.5% + 72 cuotas de USD 596 + I.V.A. 10.5% o 72 cuotas de USD 1196 + I.V.A. 10.5% Entrega e instalación en todo el país 100% Habilitables Ingeniero & Arquitecto Fabricación en planta especializada Dice Instalación en todo el país. Distribución: – Dos (2) dormitorio, con ventana (0.8 mts x 2 mts) y persiana corrediza metálica con cierre interno, puerta placa de comunicación interior al pasillo. Placar (1mts) puertas corredizas. Uno de los dormitorios cuenta con puerta corrediza de comunicación al living para su posible uso como estudio. – Un (1) baño completo, incluye inodoro con deposito exterior, bidet, receptáculo ducho (150cm x 70cm) + media ampara vidrio, calefón eléctrico y ventana (50 cm x 100 cm), puerta placa de comunicación al ante baño. – Un (1) ante baño con vanistorio y puerta de comunicación al baño y otra al pasillo. – Una (1) Cocina, con bajo mesada de 180 cm mesada y alacena de 120cm. Una (1) ventanas corredizas (1.5 mts x 0.5 mts) y persianas corredizas metálica con cierre interno. – Un (1) living comedor con Dos (2) ventanas (2.2 mts x 2.2 mts) con persiana metálica. Una (1) puerta (0.8 mts x 2 mts). Una ventana (1.8 mts x 2 mts) y persianas corredizas metálica con cierre interno. Terminaciones: – Pintura exterior poliuretano color elección. – Revestimiento térmico interior de lana de vidrio. Revestimiento de terminación mdf 9mm pintado. – Revestimiento Baño durlock 9mm pintado blanco. – Conexiones de agua fria y caliente con sus respectivos artículos de funcionamiento, conexiones mediante caños de pvc unidos por termo fusión. – Conexión eléctrica interior embutida, distribuida a través de tubos corrugados ignífugos, iluminación led, con 6 plafones en cocina comedor, dos plafones en baño y un plafón en dormitorio. Cuenta con luces exterior. tomas y puntos correspondientes a cada habitación. Incluye térmica y disyuntor. – Pisos flotantes (7mm) madera. – Aberturas en aluminio blanco línea Módena. – Dos (2) Aire acondicionado frio calor de 2000fg. Plano Propiedad: Casa Container 60m² Casa Container 90m2 5 Amb 2 Baño ver más Casa Container 60m² 4 Amb 1 Baño ver más Casa Container 30m² 2 Amb 1 Baño ver más Casa Container 15m² 1 Amb 1 Baño ver más Consultanos por whatsapp Con sólo un click +54 9 341 675-6601 Tu próximo proyecto, comienza contactándonos! Paulo VI 670 2124 Villa Gobernador Galvez - Santa Fe +54 9 341 675-6601 dicecontainers@gmail.com Lunes A Viernes de 8:00 a 16:00 Hs",
      "screenshotFile": "03-section-casa-container-60m-3.png",
      "m2": "15m²",
      "price": "USD 44463",
      "rooms": "4 Ambiente"
    },
    {
      "name": "Servicios",
      "url": "https://dicecontainers.com.ar/propiedades-dice/casa-container-60m%c2%b2/#",
      "specs": [
        "1 Baño",
        "2 Baño",
        "1 Baño",
        "1 Baño",
        "1 Baño",
        "living",
        "Cocina",
        "living",
        "comedor",
        "cocina",
        "comedor"
      ],
      "fullText": "Ir al contenido Home Propiedades Casa Container 15m² Casa Container 30m² Casa Container 60m² Casa Container 90m2 Quienes Somos Servicios Fabricación Habilitaciones Contratación Asesoramiento Opiniones Contacto Home Propiedades Casa Container 15m² Casa Container 30m² Casa Container 60m² Casa Container 90m2 Quienes Somos Servicios Fabricación Habilitaciones Contratación Asesoramiento Opiniones Contacto Home Propiedades Casa Container 15m² Casa Container 30m² Casa Container 60m² Casa Container 90m2 Quienes Somos Servicios Fabricación Habilitaciones Contratación Asesoramiento Opiniones Contacto Home Propiedades Casa Container 15m² Casa Container 30m² Casa Container 60m² Casa Container 90m2 Quienes Somos Servicios Fabricación Habilitaciones Contratación Asesoramiento Opiniones Contacto Home Propiedades Casa Container 15m² Casa Container 30m² Casa Container 60m² Casa Container 90m2 Quienes Somos Servicios Fabricación Habilitaciones Contratación Asesoramiento Opiniones Contacto Home Propiedades Casa Container 15m² Casa Container 30m² Casa Container 60m² Casa Container 90m2 Quienes Somos Servicios Fabricación Habilitaciones Contratación Asesoramiento Opiniones Contacto Casa Container 60m² 4 Ambiente/s 1 Baño/s Pies: 80 Largo: 12 mts. Ancho: 4.86 mts. Alto: 2.89 mts. Contado: USD 44463 + I.V.A. 10.5% o adelanto de USD 22232 + I.V.A. 10.5% + 72 cuotas de USD 596 + I.V.A. 10.5% o 72 cuotas de USD 1196 + I.V.A. 10.5% Entrega e instalación en todo el país 100% Habilitables Ingeniero & Arquitecto Fabricación en planta especializada Dice Instalación en todo el país. Distribución: – Dos (2) dormitorio, con ventana (0.8 mts x 2 mts) y persiana corrediza metálica con cierre interno, puerta placa de comunicación interior al pasillo. Placar (1mts) puertas corredizas. Uno de los dormitorios cuenta con puerta corrediza de comunicación al living para su posible uso como estudio. – Un (1) baño completo, incluye inodoro con deposito exterior, bidet, receptáculo ducho (150cm x 70cm) + media ampara vidrio, calefón eléctrico y ventana (50 cm x 100 cm), puerta placa de comunicación al ante baño. – Un (1) ante baño con vanistorio y puerta de comunicación al baño y otra al pasillo. – Una (1) Cocina, con bajo mesada de 180 cm mesada y alacena de 120cm. Una (1) ventanas corredizas (1.5 mts x 0.5 mts) y persianas corredizas metálica con cierre interno. – Un (1) living comedor con Dos (2) ventanas (2.2 mts x 2.2 mts) con persiana metálica. Una (1) puerta (0.8 mts x 2 mts). Una ventana (1.8 mts x 2 mts) y persianas corredizas metálica con cierre interno. Terminaciones: – Pintura exterior poliuretano color elección. – Revestimiento térmico interior de lana de vidrio. Revestimiento de terminación mdf 9mm pintado. – Revestimiento Baño durlock 9mm pintado blanco. – Conexiones de agua fria y caliente con sus respectivos artículos de funcionamiento, conexiones mediante caños de pvc unidos por termo fusión. – Conexión eléctrica interior embutida, distribuida a través de tubos corrugados ignífugos, iluminación led, con 6 plafones en cocina comedor, dos plafones en baño y un plafón en dormitorio. Cuenta con luces exterior. tomas y puntos correspondientes a cada habitación. Incluye térmica y disyuntor. – Pisos flotantes (7mm) madera. – Aberturas en aluminio blanco línea Módena. – Dos (2) Aire acondicionado frio calor de 2000fg. Plano Propiedad: Casa Container 60m² Casa Container 90m2 5 Amb 2 Baño ver más Casa Container 60m² 4 Amb 1 Baño ver más Casa Container 30m² 2 Amb 1 Baño ver más Casa Container 15m² 1 Amb 1 Baño ver más Consultanos por whatsapp Con sólo un click +54 9 341 675-6601 Tu próximo proyecto, comienza contactándonos! Paulo VI 670 2124 Villa Gobernador Galvez - Santa Fe +54 9 341 675-6601 dicecontainers@gmail.com Lunes A Viernes de 8:00 a 16:00 Hs",
      "screenshotFile": "03-section-casa-container-60m-3.png",
      "m2": "15m²",
      "price": "USD 44463",
      "rooms": "4 Ambiente"
    },
    {
      "name": "Ir al contenido",
      "url": "https://dicecontainers.com.ar/propiedades-dice/casa-container-90m2/#content",
      "specs": [
        "2 Baño",
        "2 Baño",
        "1 Baño",
        "1 Baño",
        "1 Baño",
        "living",
        "Cocina",
        "living",
        "comedor",
        "cocina",
        "comedor"
      ],
      "fullText": "Ir al contenido Home Propiedades Casa Container 15m² Casa Container 30m² Casa Container 60m² Casa Container 90m2 Quienes Somos Servicios Fabricación Habilitaciones Contratación Asesoramiento Opiniones Contacto Home Propiedades Casa Container 15m² Casa Container 30m² Casa Container 60m² Casa Container 90m2 Quienes Somos Servicios Fabricación Habilitaciones Contratación Asesoramiento Opiniones Contacto Home Propiedades Casa Container 15m² Casa Container 30m² Casa Container 60m² Casa Container 90m2 Quienes Somos Servicios Fabricación Habilitaciones Contratación Asesoramiento Opiniones Contacto Home Propiedades Casa Container 15m² Casa Container 30m² Casa Container 60m² Casa Container 90m2 Quienes Somos Servicios Fabricación Habilitaciones Contratación Asesoramiento Opiniones Contacto Home Propiedades Casa Container 15m² Casa Container 30m² Casa Container 60m² Casa Container 90m2 Quienes Somos Servicios Fabricación Habilitaciones Contratación Asesoramiento Opiniones Contacto Home Propiedades Casa Container 15m² Casa Container 30m² Casa Container 60m² Casa Container 90m2 Quienes Somos Servicios Fabricación Habilitaciones Contratación Asesoramiento Opiniones Contacto Casa Container 90m2 5 Ambiente/s 2 Baño/s Pies: 120 Largo: 12 mts. Ancho: 7.29 mts. Alto: 2.89 mts. Contado: USD 65381 + I.V.A. 10.5% o adelanto de USD 32690 + I.V.A. 10.5% + 72 cuotas de USD 879 + I.V.A. 10.5% o 72 cuotas de USD 1758 + I.V.A. 10.5% Entrega e instalación en todo el país 100% Habilitables Ingeniero & Arquitecto Fabricación en planta especializada Dice Instalación en todo el país. Distribución: – Tres (3) dormitorio, con ventana (0.8 mts x 2 mts) y persiana corrediza metálica con cierre interno, puerta placa de comunicación interior al pasillo. Placar (1mts) puertas corredizas. Uno de los dormitorios cuenta con puerta corrediza de comunicación al living para su posible uso como estudio. Uno de los dormitorios cuenta con vestidor. – Un (1) baño completo, incluye inodoro con deposito exterior, bidetmatic, receptáculo ducho (150cm x 70cm) + media ampara vidrio, calefón eléctrico y ventana (50 cm x 100 cm), puerta placa de comunicación al cambiador. – Un (1) baño completo, incluye inodoro con deposito exterior, bidet, receptáculo ducho (150cm x 70cm) + media ampara vidrio, calefón eléctrico puerta placa de comunicación al ante baño. – Un (1) ante baño con vanistorio y puerta de comunicación al baño y otra al pasillo. – Una (1) Cocina, con bajo mesada de 180 cm mesada y alacena de 120cm. Una (1) ventanas corredizas (1.5 mts x 0.5 mts) y persianas corredizas metálica con cierre interno. – Un (1) living comedor con Dos (2) ventanas (2.2 mts x 2.2 mts) con persiana metálica. Una (1) puerta (0.8 mts x 2 mts). Una ventana (1.8 mts x 2 mts) y persianas corredizas metálica con cierre interno. Terminaciones: – Pintura exterior poliuretano color elección. – Revestimiento térmico interior de lana de vidrio. Revestimiento de terminación mdf 9mm pintado. – Revestimiento Baño durlock 9mm pintado blanco. – Conexiones de agua fria y caliente con sus respectivos artículos de funcionamiento, conexiones mediante caños de pvc unidos por termo fusión. – Conexión eléctrica interior embutida, distribuida a través de tubos corrugados ignífugos, iluminación led, con 6 plafones en cocina comedor, dos plafones en baño y un plafón en dormitorio. Cuenta con luces exterior. tomas y puntos correspondientes a cada habitación. Incluye térmica y disyuntor. – Pisos flotantes (7mm) madera. – Aberturas en aluminio blanco línea Módena. – Tres (3) Aire acondicionado frio calor de 2000fg. Plano Propiedad: Casa Container 90m2 Casa Container 90m2 5 Amb 2 Baño ver más Casa Container 60m² 4 Amb 1 Baño ver más Casa Container 30m² 2 Amb 1 Baño ver más Casa Container 15m² 1 Amb 1 Baño ver más Consultanos por whatsapp Con sólo un click +54 9 341 675-6601 Tu próximo proyecto, comienza contactándonos! Paulo VI 670 2124 Villa Gobernador Galvez - Santa Fe +54 9 341 675-6601 dicecontainers@gmail.com Lunes A Viernes de 8:00 a 16:00 Hs",
      "screenshotFile": "03-section-casa-container-90m2-4.png",
      "m2": "15m²",
      "price": "USD 65381",
      "rooms": "5 Ambiente"
    },
    {
      "name": "Servicios",
      "url": "https://dicecontainers.com.ar/propiedades-dice/casa-container-90m2/#",
      "specs": [
        "2 Baño",
        "2 Baño",
        "1 Baño",
        "1 Baño",
        "1 Baño",
        "living",
        "Cocina",
        "living",
        "comedor",
        "cocina",
        "comedor"
      ],
      "fullText": "Ir al contenido Home Propiedades Casa Container 15m² Casa Container 30m² Casa Container 60m² Casa Container 90m2 Quienes Somos Servicios Fabricación Habilitaciones Contratación Asesoramiento Opiniones Contacto Home Propiedades Casa Container 15m² Casa Container 30m² Casa Container 60m² Casa Container 90m2 Quienes Somos Servicios Fabricación Habilitaciones Contratación Asesoramiento Opiniones Contacto Home Propiedades Casa Container 15m² Casa Container 30m² Casa Container 60m² Casa Container 90m2 Quienes Somos Servicios Fabricación Habilitaciones Contratación Asesoramiento Opiniones Contacto Home Propiedades Casa Container 15m² Casa Container 30m² Casa Container 60m² Casa Container 90m2 Quienes Somos Servicios Fabricación Habilitaciones Contratación Asesoramiento Opiniones Contacto Home Propiedades Casa Container 15m² Casa Container 30m² Casa Container 60m² Casa Container 90m2 Quienes Somos Servicios Fabricación Habilitaciones Contratación Asesoramiento Opiniones Contacto Home Propiedades Casa Container 15m² Casa Container 30m² Casa Container 60m² Casa Container 90m2 Quienes Somos Servicios Fabricación Habilitaciones Contratación Asesoramiento Opiniones Contacto Casa Container 90m2 5 Ambiente/s 2 Baño/s Pies: 120 Largo: 12 mts. Ancho: 7.29 mts. Alto: 2.89 mts. Contado: USD 65381 + I.V.A. 10.5% o adelanto de USD 32690 + I.V.A. 10.5% + 72 cuotas de USD 879 + I.V.A. 10.5% o 72 cuotas de USD 1758 + I.V.A. 10.5% Entrega e instalación en todo el país 100% Habilitables Ingeniero & Arquitecto Fabricación en planta especializada Dice Instalación en todo el país. Distribución: – Tres (3) dormitorio, con ventana (0.8 mts x 2 mts) y persiana corrediza metálica con cierre interno, puerta placa de comunicación interior al pasillo. Placar (1mts) puertas corredizas. Uno de los dormitorios cuenta con puerta corrediza de comunicación al living para su posible uso como estudio. Uno de los dormitorios cuenta con vestidor. – Un (1) baño completo, incluye inodoro con deposito exterior, bidetmatic, receptáculo ducho (150cm x 70cm) + media ampara vidrio, calefón eléctrico y ventana (50 cm x 100 cm), puerta placa de comunicación al cambiador. – Un (1) baño completo, incluye inodoro con deposito exterior, bidet, receptáculo ducho (150cm x 70cm) + media ampara vidrio, calefón eléctrico puerta placa de comunicación al ante baño. – Un (1) ante baño con vanistorio y puerta de comunicación al baño y otra al pasillo. – Una (1) Cocina, con bajo mesada de 180 cm mesada y alacena de 120cm. Una (1) ventanas corredizas (1.5 mts x 0.5 mts) y persianas corredizas metálica con cierre interno. – Un (1) living comedor con Dos (2) ventanas (2.2 mts x 2.2 mts) con persiana metálica. Una (1) puerta (0.8 mts x 2 mts). Una ventana (1.8 mts x 2 mts) y persianas corredizas metálica con cierre interno. Terminaciones: – Pintura exterior poliuretano color elección. – Revestimiento térmico interior de lana de vidrio. Revestimiento de terminación mdf 9mm pintado. – Revestimiento Baño durlock 9mm pintado blanco. – Conexiones de agua fria y caliente con sus respectivos artículos de funcionamiento, conexiones mediante caños de pvc unidos por termo fusión. – Conexión eléctrica interior embutida, distribuida a través de tubos corrugados ignífugos, iluminación led, con 6 plafones en cocina comedor, dos plafones en baño y un plafón en dormitorio. Cuenta con luces exterior. tomas y puntos correspondientes a cada habitación. Incluye térmica y disyuntor. – Pisos flotantes (7mm) madera. – Aberturas en aluminio blanco línea Módena. – Tres (3) Aire acondicionado frio calor de 2000fg. Plano Propiedad: Casa Container 90m2 Casa Container 90m2 5 Amb 2 Baño ver más Casa Container 60m² 4 Amb 1 Baño ver más Casa Container 30m² 2 Amb 1 Baño ver más Casa Container 15m² 1 Amb 1 Baño ver más Consultanos por whatsapp Con sólo un click +54 9 341 675-6601 Tu próximo proyecto, comienza contactándonos! Paulo VI 670 2124 Villa Gobernador Galvez - Santa Fe +54 9 341 675-6601 dicecontainers@gmail.com Lunes A Viernes de 8:00 a 16:00 Hs",
      "screenshotFile": "03-section-casa-container-90m2-4.png",
      "m2": "15m²",
      "price": "USD 65381",
      "rooms": "5 Ambiente"
    },
    {
      "name": "Ir al contenido",
      "url": "https://dicecontainers.com.ar/propiedades-dice/#content",
      "specs": [
        "2 Baño",
        "1 Baño",
        "1 Baño",
        "1 Baño"
      ],
      "fullText": "Ir al contenido Home Propiedades Casa Container 15m² Casa Container 30m² Casa Container 60m² Casa Container 90m2 Quienes Somos Servicios Fabricación Habilitaciones Contratación Asesoramiento Opiniones Contacto Home Propiedades Casa Container 15m² Casa Container 30m² Casa Container 60m² Casa Container 90m2 Quienes Somos Servicios Fabricación Habilitaciones Contratación Asesoramiento Opiniones Contacto Home Propiedades Casa Container 15m² Casa Container 30m² Casa Container 60m² Casa Container 90m2 Quienes Somos Servicios Fabricación Habilitaciones Contratación Asesoramiento Opiniones Contacto Home Propiedades Casa Container 15m² Casa Container 30m² Casa Container 60m² Casa Container 90m2 Quienes Somos Servicios Fabricación Habilitaciones Contratación Asesoramiento Opiniones Contacto Home Propiedades Casa Container 15m² Casa Container 30m² Casa Container 60m² Casa Container 90m2 Quienes Somos Servicios Fabricación Habilitaciones Contratación Asesoramiento Opiniones Contacto Home Propiedades Casa Container 15m² Casa Container 30m² Casa Container 60m² Casa Container 90m2 Quienes Somos Servicios Fabricación Habilitaciones Contratación Asesoramiento Opiniones Contacto Propiedades Dice Casa Container 90m2 5 Amb 2 Baño ver más Casa Container 60m² 4 Amb 1 Baño ver más Casa Container 30m² 2 Amb 1 Baño ver más Casa Container 15m² 1 Amb 1 Baño ver más Consultanos por whatsapp Con sólo un click +54 9 341 675-6601 Tu próximo proyecto, comienza contactándonos! Paulo VI 670 2124 Villa Gobernador Galvez - Santa Fe +54 9 341 675-6601 dicecontainers@gmail.com Lunes A Viernes de 8:00 a 16:00 Hs",
      "screenshotFile": "03-section-casas-containerhasta-72-cuotas-fijasver-m-s-5.png",
      "m2": "15m²"
    },
    {
      "name": "Servicios",
      "url": "https://dicecontainers.com.ar/propiedades-dice/#",
      "specs": [
        "2 Baño",
        "1 Baño",
        "1 Baño",
        "1 Baño"
      ],
      "fullText": "Ir al contenido Home Propiedades Casa Container 15m² Casa Container 30m² Casa Container 60m² Casa Container 90m2 Quienes Somos Servicios Fabricación Habilitaciones Contratación Asesoramiento Opiniones Contacto Home Propiedades Casa Container 15m² Casa Container 30m² Casa Container 60m² Casa Container 90m2 Quienes Somos Servicios Fabricación Habilitaciones Contratación Asesoramiento Opiniones Contacto Home Propiedades Casa Container 15m² Casa Container 30m² Casa Container 60m² Casa Container 90m2 Quienes Somos Servicios Fabricación Habilitaciones Contratación Asesoramiento Opiniones Contacto Home Propiedades Casa Container 15m² Casa Container 30m² Casa Container 60m² Casa Container 90m2 Quienes Somos Servicios Fabricación Habilitaciones Contratación Asesoramiento Opiniones Contacto Home Propiedades Casa Container 15m² Casa Container 30m² Casa Container 60m² Casa Container 90m2 Quienes Somos Servicios Fabricación Habilitaciones Contratación Asesoramiento Opiniones Contacto Home Propiedades Casa Container 15m² Casa Container 30m² Casa Container 60m² Casa Container 90m2 Quienes Somos Servicios Fabricación Habilitaciones Contratación Asesoramiento Opiniones Contacto Propiedades Dice Casa Container 90m2 5 Amb 2 Baño ver más Casa Container 60m² 4 Amb 1 Baño ver más Casa Container 30m² 2 Amb 1 Baño ver más Casa Container 15m² 1 Amb 1 Baño ver más Consultanos por whatsapp Con sólo un click +54 9 341 675-6601 Tu próximo proyecto, comienza contactándonos! Paulo VI 670 2124 Villa Gobernador Galvez - Santa Fe +54 9 341 675-6601 dicecontainers@gmail.com Lunes A Viernes de 8:00 a 16:00 Hs",
      "screenshotFile": "03-section-casas-containerhasta-72-cuotas-fijasver-m-s-5.png",
      "m2": "15m²"
    }
  ],
  "pdfLinks": [],
  "allLinks": [
    {
      "text": "Ir al contenido",
      "href": "https://dicecontainers.com.ar/#content"
    },
    {
      "text": "",
      "href": "https://dicecontainers.com.ar/"
    },
    {
      "text": "Home",
      "href": "https://dicecontainers.com.ar/"
    },
    {
      "text": "Propiedades",
      "href": "https://www.dicecontainers.com.ar/propiedades-dice"
    },
    {
      "text": "Casa Container 15m²",
      "href": "https://dicecontainers.com.ar/propiedades-dice/casa-container-15m%c2%b2/"
    },
    {
      "text": "Casa Container 30m²",
      "href": "https://dicecontainers.com.ar/propiedades-dice/casa-container-30m%c2%b2/"
    },
    {
      "text": "Casa Container 60m²",
      "href": "https://dicecontainers.com.ar/propiedades-dice/casa-container-60m%c2%b2/"
    },
    {
      "text": "Casa Container 90m2",
      "href": "https://dicecontainers.com.ar/propiedades-dice/casa-container-90m2/"
    },
    {
      "text": "Quienes Somos",
      "href": "https://dicecontainers.com.ar/#quienessomos"
    },
    {
      "text": "Servicios",
      "href": "https://dicecontainers.com.ar/#"
    },
    {
      "text": "Fabricación",
      "href": "https://dicecontainers.com.ar/#fabricacion"
    },
    {
      "text": "Habilitaciones",
      "href": "https://dicecontainers.com.ar/#habilitaciones"
    },
    {
      "text": "Contratación",
      "href": "https://dicecontainers.com.ar/#contratacion"
    },
    {
      "text": "Asesoramiento",
      "href": "https://dicecontainers.com.ar/#asesoramiento"
    },
    {
      "text": "Opiniones",
      "href": "https://dicecontainers.com.ar/#opiniones"
    },
    {
      "text": "Contacto",
      "href": "https://dicecontainers.com.ar/#contacto"
    },
    {
      "text": "Home",
      "href": "https://dicecontainers.com.ar/"
    },
    {
      "text": "Propiedades",
      "href": "https://www.dicecontainers.com.ar/propiedades-dice"
    },
    {
      "text": "Casa Container 15m²",
      "href": "https://dicecontainers.com.ar/propiedades-dice/casa-container-15m%c2%b2/"
    },
    {
      "text": "Casa Container 30m²",
      "href": "https://dicecontainers.com.ar/propiedades-dice/casa-container-30m%c2%b2/"
    },
    {
      "text": "Casa Container 60m²",
      "href": "https://dicecontainers.com.ar/propiedades-dice/casa-container-60m%c2%b2/"
    },
    {
      "text": "Casa Container 90m2",
      "href": "https://dicecontainers.com.ar/propiedades-dice/casa-container-90m2/"
    },
    {
      "text": "Quienes Somos",
      "href": "https://dicecontainers.com.ar/#quienessomos"
    },
    {
      "text": "Servicios",
      "href": "https://dicecontainers.com.ar/#"
    },
    {
      "text": "Fabricación",
      "href": "https://dicecontainers.com.ar/#fabricacion"
    },
    {
      "text": "Habilitaciones",
      "href": "https://dicecontainers.com.ar/#habilitaciones"
    },
    {
      "text": "Contratación",
      "href": "https://dicecontainers.com.ar/#contratacion"
    },
    {
      "text": "Asesoramiento",
      "href": "https://dicecontainers.com.ar/#asesoramiento"
    },
    {
      "text": "Opiniones",
      "href": "https://dicecontainers.com.ar/#opiniones"
    },
    {
      "text": "Contacto",
      "href": "https://dicecontainers.com.ar/#contacto"
    },
    {
      "text": "",
      "href": "http://instagram.com/dicecontainers"
    },
    {
      "text": "",
      "href": "https://dicecontainers.com.ar/"
    },
    {
      "text": "Home",
      "href": "https://dicecontainers.com.ar/"
    },
    {
      "text": "Propiedades",
      "href": "https://www.dicecontainers.com.ar/propiedades-dice"
    },
    {
      "text": "Casa Container 15m²",
      "href": "https://dicecontainers.com.ar/propiedades-dice/casa-container-15m%c2%b2/"
    },
    {
      "text": "Casa Container 30m²",
      "href": "https://dicecontainers.com.ar/propiedades-dice/casa-container-30m%c2%b2/"
    },
    {
      "text": "Casa Container 60m²",
      "href": "https://dicecontainers.com.ar/propiedades-dice/casa-container-60m%c2%b2/"
    },
    {
      "text": "Casa Container 90m2",
      "href": "https://dicecontainers.com.ar/propiedades-dice/casa-container-90m2/"
    },
    {
      "text": "Quienes Somos",
      "href": "https://dicecontainers.com.ar/#quienessomos"
    },
    {
      "text": "Servicios",
      "href": "https://dicecontainers.com.ar/#"
    },
    {
      "text": "Fabricación",
      "href": "https://dicecontainers.com.ar/#fabricacion"
    },
    {
      "text": "Habilitaciones",
      "href": "https://dicecontainers.com.ar/#habilitaciones"
    },
    {
      "text": "Contratación",
      "href": "https://dicecontainers.com.ar/#contratacion"
    },
    {
      "text": "Asesoramiento",
      "href": "https://dicecontainers.com.ar/#asesoramiento"
    },
    {
      "text": "Opiniones",
      "href": "https://dicecontainers.com.ar/#opiniones"
    },
    {
      "text": "Contacto",
      "href": "https://dicecontainers.com.ar/#contacto"
    },
    {
      "text": "Home",
      "href": "https://dicecontainers.com.ar/"
    },
    {
      "text": "Propiedades",
      "href": "https://www.dicecontainers.com.ar/propiedades-dice"
    },
    {
      "text": "Casa Container 15m²",
      "href": "https://dicecontainers.com.ar/propiedades-dice/casa-container-15m%c2%b2/"
    },
    {
      "text": "Casa Container 30m²",
      "href": "https://dicecontainers.com.ar/propiedades-dice/casa-container-30m%c2%b2/"
    },
    {
      "text": "Casa Container 60m²",
      "href": "https://dicecontainers.com.ar/propiedades-dice/casa-container-60m%c2%b2/"
    },
    {
      "text": "Casa Container 90m2",
      "href": "https://dicecontainers.com.ar/propiedades-dice/casa-container-90m2/"
    },
    {
      "text": "Quienes Somos",
      "href": "https://dicecontainers.com.ar/#quienessomos"
    },
    {
      "text": "Servicios",
      "href": "https://dicecontainers.com.ar/#"
    },
    {
      "text": "Fabricación",
      "href": "https://dicecontainers.com.ar/#fabricacion"
    },
    {
      "text": "Habilitaciones",
      "href": "https://dicecontainers.com.ar/#habilitaciones"
    },
    {
      "text": "Contratación",
      "href": "https://dicecontainers.com.ar/#contratacion"
    },
    {
      "text": "Asesoramiento",
      "href": "https://dicecontainers.com.ar/#asesoramiento"
    },
    {
      "text": "Opiniones",
      "href": "https://dicecontainers.com.ar/#opiniones"
    },
    {
      "text": "Contacto",
      "href": "https://dicecontainers.com.ar/#contacto"
    },
    {
      "text": "",
      "href": "http://instagram.com/dicecontainers"
    },
    {
      "text": "",
      "href": "https://dicecontainers.com.ar/"
    },
    {
      "text": "",
      "href": "http://instagram.com/dicecontainers"
    },
    {
      "text": "Home",
      "href": "https://dicecontainers.com.ar/"
    },
    {
      "text": "Propiedades",
      "href": "https://www.dicecontainers.com.ar/propiedades-dice"
    },
    {
      "text": "Casa Container 15m²",
      "href": "https://dicecontainers.com.ar/propiedades-dice/casa-container-15m%c2%b2/"
    },
    {
      "text": "Casa Container 30m²",
      "href": "https://dicecontainers.com.ar/propiedades-dice/casa-container-30m%c2%b2/"
    },
    {
      "text": "Casa Container 60m²",
      "href": "https://dicecontainers.com.ar/propiedades-dice/casa-container-60m%c2%b2/"
    },
    {
      "text": "Casa Container 90m2",
      "href": "https://dicecontainers.com.ar/propiedades-dice/casa-container-90m2/"
    },
    {
      "text": "Quienes Somos",
      "href": "https://dicecontainers.com.ar/#quienessomos"
    },
    {
      "text": "Servicios",
      "href": "https://dicecontainers.com.ar/#"
    },
    {
      "text": "Fabricación",
      "href": "https://dicecontainers.com.ar/#fabricacion"
    },
    {
      "text": "Habilitaciones",
      "href": "https://dicecontainers.com.ar/#habilitaciones"
    },
    {
      "text": "Contratación",
      "href": "https://dicecontainers.com.ar/#contratacion"
    },
    {
      "text": "Asesoramiento",
      "href": "https://dicecontainers.com.ar/#asesoramiento"
    },
    {
      "text": "Opiniones",
      "href": "https://dicecontainers.com.ar/#opiniones"
    },
    {
      "text": "Contacto",
      "href": "https://dicecontainers.com.ar/#contacto"
    },
    {
      "text": "",
      "href": "https://dicecontainers.com.ar/"
    },
    {
      "text": "",
      "href": "http://instagram.com/dicecontainers"
    },
    {
      "text": "Home",
      "href": "https://dicecontainers.com.ar/"
    },
    {
      "text": "Propiedades",
      "href": "https://www.dicecontainers.com.ar/propiedades-dice"
    },
    {
      "text": "Casa Container 15m²",
      "href": "https://dicecontainers.com.ar/propiedades-dice/casa-container-15m%c2%b2/"
    },
    {
      "text": "Casa Container 30m²",
      "href": "https://dicecontainers.com.ar/propiedades-dice/casa-container-30m%c2%b2/"
    },
    {
      "text": "Casa Container 60m²",
      "href": "https://dicecontainers.com.ar/propiedades-dice/casa-container-60m%c2%b2/"
    },
    {
      "text": "Casa Container 90m2",
      "href": "https://dicecontainers.com.ar/propiedades-dice/casa-container-90m2/"
    },
    {
      "text": "Quienes Somos",
      "href": "https://dicecontainers.com.ar/#quienessomos"
    },
    {
      "text": "Servicios",
      "href": "https://dicecontainers.com.ar/#"
    },
    {
      "text": "Fabricación",
      "href": "https://dicecontainers.com.ar/#fabricacion"
    },
    {
      "text": "Habilitaciones",
      "href": "https://dicecontainers.com.ar/#habilitaciones"
    },
    {
      "text": "Contratación",
      "href": "https://dicecontainers.com.ar/#contratacion"
    },
    {
      "text": "Asesoramiento",
      "href": "https://dicecontainers.com.ar/#asesoramiento"
    },
    {
      "text": "Opiniones",
      "href": "https://dicecontainers.com.ar/#opiniones"
    },
    {
      "text": "Contacto",
      "href": "https://dicecontainers.com.ar/#contacto"
    },
    {
      "text": "CASAS CONTAINERHASTA 72 CUOTAS FIJASVER MÁS",
      "href": "https://dicecontainers.com.ar/propiedades-dice/"
    },
    {
      "text": "CASAS CONTAINERHASTA 72 CUOTAS FIJASVER MÁS",
      "href": "https://dicecontainers.com.ar/propiedades-dice/"
    },
    {
      "text": "CASAS CONTAINERHASTA 72 CUOTAS FIJASVER MÁS",
      "href": "https://dicecontainers.com.ar/propiedades-dice/"
    },
    {
      "text": "ver más",
      "href": "https://dicecontainers.com.ar/propiedades-dice/casa-container-90m2/"
    },
    {
      "text": "ver más",
      "href": "https://dicecontainers.com.ar/propiedades-dice/casa-container-60m%c2%b2/"
    },
    {
      "text": "ver más",
      "href": "https://dicecontainers.com.ar/propiedades-dice/casa-container-30m%c2%b2/"
    },
    {
      "text": "ver más",
      "href": "https://dicecontainers.com.ar/propiedades-dice/casa-container-15m%c2%b2/"
    },
    {
      "text": "",
      "href": "https://dicecontainers.com.ar/wp-content/uploads/2022/06/1.jpg"
    },
    {
      "text": "",
      "href": "https://dicecontainers.com.ar/wp-content/uploads/2022/02/IMG_0357-2.jpg"
    },
    {
      "text": "",
      "href": "https://dicecontainers.com.ar/wp-content/uploads/2022/02/20210916_181540-2.jpg"
    },
    {
      "text": "",
      "href": "https://dicecontainers.com.ar/wp-content/uploads/2022/02/20210916_165914-2.jpg"
    },
    {
      "text": "",
      "href": "https://dicecontainers.com.ar/wp-content/uploads/2022/02/20210916_182259-2.jpg"
    },
    {
      "text": "",
      "href": "https://dicecontainers.com.ar/wp-content/uploads/2022/02/20210916_181705.jpg"
    },
    {
      "text": "",
      "href": "https://dicecontainers.com.ar/wp-content/uploads/2022/02/7704baae-cf88-4f26-8a49-355b89436b4a.jpg"
    },
    {
      "text": "",
      "href": "https://dicecontainers.com.ar/wp-content/uploads/2022/02/d4906302-de73-40b1-b1a5-dd88db39cfa5.jpg"
    },
    {
      "text": "",
      "href": "https://dicecontainers.com.ar/wp-content/uploads/2023/06/003.png"
    },
    {
      "text": "",
      "href": "https://dicecontainers.com.ar/wp-content/uploads/2023/06/000.png"
    },
    {
      "text": "",
      "href": "https://dicecontainers.com.ar/wp-content/uploads/2023/06/20230317_133217-scaled.jpg"
    },
    {
      "text": "",
      "href": "https://dicecontainers.com.ar/wp-content/uploads/2023/06/20230317_133107-scaled.jpg"
    },
    {
      "text": "",
      "href": "https://dicecontainers.com.ar/wp-content/uploads/2023/06/20230317_142218-scaled.jpg"
    },
    {
      "text": "",
      "href": "https://dicecontainers.com.ar/wp-content/uploads/2023/06/20230317_132941-1-scaled.jpg"
    },
    {
      "text": "",
      "href": "https://dicecontainers.com.ar/wp-content/uploads/2023/06/20230317_142243-scaled.jpg"
    },
    {
      "text": "",
      "href": "https://dicecontainers.com.ar/wp-content/uploads/2023/06/20230317_142342.png"
    },
    {
      "text": "",
      "href": "https://dicecontainers.com.ar/wp-content/uploads/2023/06/20230317_133100-scaled.jpg"
    },
    {
      "text": "",
      "href": "https://dicecontainers.com.ar/wp-content/uploads/2023/06/20230317_132934-scaled.jpg"
    },
    {
      "text": "",
      "href": "https://dicecontainers.com.ar/wp-content/uploads/2023/06/20230317_133022-scaled.jpg"
    },
    {
      "text": "",
      "href": "https://dicecontainers.com.ar/wp-content/uploads/2023/06/20230317_133117-scaled.jpg"
    },
    {
      "text": "",
      "href": "https://dicecontainers.com.ar/wp-content/uploads/2023/06/20230317_133042-scaled.jpg"
    },
    {
      "text": "",
      "href": "https://dicecontainers.com.ar/wp-content/uploads/2023/06/20230317_142404-scaled.jpg"
    },
    {
      "text": "",
      "href": "https://dicecontainers.com.ar/wp-content/uploads/2023/06/20230317_142243-1-scaled.jpg"
    },
    {
      "text": "",
      "href": "https://dicecontainers.com.ar/wp-content/uploads/2023/06/WhatsApp-Image-2023-06-12-at-18.28.39-2.jpeg"
    },
    {
      "text": "",
      "href": "https://dicecontainers.com.ar/wp-content/uploads/2023/06/WhatsApp-Image-2023-06-12-at-18.29.03.jpeg"
    },
    {
      "text": "",
      "href": "https://dicecontainers.com.ar/wp-content/uploads/2023/06/WhatsApp-Image-2023-06-12-at-18.28.39-1.jpeg"
    },
    {
      "text": "",
      "href": "https://dicecontainers.com.ar/wp-content/uploads/2023/06/WhatsApp-Image-2023-06-12-at-18.28.39-3.jpeg"
    },
    {
      "text": "",
      "href": "https://dicecontainers.com.ar/wp-content/uploads/2023/06/WhatsApp-Image-2023-06-12-at-18.28.39.jpeg"
    },
    {
      "text": "+54 9 341 675-6601",
      "href": "https://api.whatsapp.com/send?phone=+5493416756601&text=Hola%20Dice%20Containers.%20Estuve%20en%20su%20sitio%20web%20y%20quiero%20realizarles%20una%20consulta..."
    },
    {
      "text": "",
      "href": "https://dicecontainers.com.ar/"
    },
    {
      "text": "+54 9 341 675-6601",
      "href": "https://api.whatsapp.com/send?phone=+5493416756601&text=Hola%20Dice%20Containers.%20Estuve%20en%20su%20sitio%20web%20y%20quiero%20realizarles%20una%20consulta..."
    },
    {
      "text": "dicecontainers@gmail.com",
      "href": "mailto:dicecontainers@gmail.com"
    },
    {
      "text": "",
      "href": "https://api.whatsapp.com/send?phone=+5493416756601&text=Hola%20Dice%20Containers.%20Estuve%20en%20su%20sitio%20web%20y%20quiero%20realizarles%20una%20consulta..."
    }
  ],
  "errors": []
}